,name,price(BTC),from,to,vendor,cat_hash,cat,date
1804,ATM Skimmer Cashing/Installing Safety,0.02672439,,,fake,giSyWeCyx4,Information/Guides,2014-10-03
1805,How to Encrypt your Skype Messages Using Pidgin,0.01870707,,,fake,giSyWeCyx4,Information/Guides,2014-10-03
1806,The FREE xbox one detailed tutorial,0.05344878,,rland,Hackyboy,giSyWeCyx4,Information/Guides,2014-10-03
1807,Hundred Ways To Disappear And Live Free PDF,0.02672439,,rland,FakeMarket,giSyWeCyx4,Information/Guides,2014-10-03
1808,GBL TO GHB SYNTHESIS - TUTORIAL,0.05344878,,Internet,everythingman,giSyWeCyx4,Information/Guides,2014-10-03
1809,Track1 from Track2,0.02137951,,,fake,giSyWeCyx4,Information/Guides,2014-10-03
1810,eBook How to Double Your Money with Paypal - How To Make Money PDF,0.06681097,,Italy,gaioso,giSyWeCyx4,Information/Guides,2014-10-03
1811,"Cannabis Cloning Made Easy, Roots in 7-10 Days",0.00320692,,,ProfesorGreen,giSyWeCyx4,Information/Guides,2014-10-03
1812,MAC ADRESS CHANGER FOR MAC OS SOFTWARE,0.02672439,,,Hackyboy,giSyWeCyx4,Information/Guides,2014-10-03
1813,How to cash out dumpz without pin,0.02672439,,,fake,giSyWeCyx4,Information/Guides,2014-10-03
1814,"Insider's Forex Trading Signals (Make Thousands of $$$'s DAILY, from my 20 yr Daytrader)",2.67243913,,,cyberzen,giSyWeCyx4,Information/Guides,2014-10-03
1815,Pass Marijuana Urine Test,0.01603463,,,fake,giSyWeCyx4,Information/Guides,2014-10-03
1816,How to cashout with the poker system,0.02672439,,rland,RastainPeace,giSyWeCyx4,Information/Guides,2014-10-03
1817,HOW TO HACK FACEBOOK,0.00133621,,Internet,montana1933,giSyWeCyx4,Information/Guides,2014-10-03
1818,"★ ★ ★ The 4-Hour Body: RADIP FAT LOSS, INCREDIBLE SEX ★ ★ ★",0.00133621,,Internet,montana1933,giSyWeCyx4,Information/Guides,2014-10-03
1819,RICH DAD MASTER TRADER Elite Training,0.53448782,,,RichDadPoorDad,giSyWeCyx4,Information/Guides,2014-10-03
1820,How to Hack Gmail Password or Account,0.01336219,,,fake,giSyWeCyx4,Information/Guides,2014-10-03
1821,BITCOIN MINING,0.01068975,,,fake,giSyWeCyx4,Information/Guides,2014-10-03
1822,How to Build A Laser Listening Device,0.01336219,,,fake,giSyWeCyx4,Information/Guides,2014-10-03
1823,UNLIMITED STEALTH PAYPAL ACCOUNTS,0.04008658,,rland,fake,giSyWeCyx4,Information/Guides,2014-10-03
1824,INTRODUCTION TO EXPERT CARDING,0.02672439,,,fake,giSyWeCyx4,Information/Guides,2014-10-03
1825,"How To Chain Socks Proxy With Tor, Carders Must Have",0.02669766,,,passman,giSyWeCyx4,Information/Guides,2014-10-03
1826,"Smuggling, Caching and Hiding Ebooks Collection",0.00264571,,Internet,captainkirk,giSyWeCyx4,Information/Guides,2014-10-03
1827,Bypass Any SMS Phone Verification Online For FREE,0.04005986,,,passman,giSyWeCyx4,Information/Guides,2014-10-03
1828,How to Make Her Want Anal Sex + Anal Sex Guide,0.01068975,,,cyberzen,giSyWeCyx4,Information/Guides,2014-10-03
1829,SELF DESTRUCTING SMS,0.02137951,,,fake,giSyWeCyx4,Information/Guides,2014-10-03
1830,"Make $2,500+ in 10 Days - Guaranteed!",0.06681097,,rland,Aracay,giSyWeCyx4,Information/Guides,2014-10-03
1831,The Unofficial MacGyver How-To Handbook,0.00264571,,Internet,captainkirk,giSyWeCyx4,Information/Guides,2014-10-03
1832,"New! Carding Method, Vulnerable Referral System",0.02669766,,,passman,giSyWeCyx4,Information/Guides,2014-10-03
1833,HOW TO ENCRYPT YOUR HARD DRIVE,0.01336219,,,fake,giSyWeCyx4,Information/Guides,2014-10-03
1834,"AUTO THEFT , RADAR JAMMING ETC",0.04008658,,,fake,giSyWeCyx4,Information/Guides,2014-10-03
1835,"Atlantis, Alien Visitation and Genetic Manipulation",0.00264571,,Internet,captainkirk,giSyWeCyx4,Information/Guides,2014-10-03
1836,Detecting Tracking Devices on Vehicles,0.02405195,,,fake,giSyWeCyx4,Information/Guides,2014-10-03
1837,The Lotto Black Book,0.00264571,,Internet,captainkirk,giSyWeCyx4,Information/Guides,2014-10-03
1838,XBOX GAMES FOR FREE - TUTORIAL,0.01870707,,,fake,giSyWeCyx4,Information/Guides,2014-10-03
1839,SERVICE: SETUP A PHISING SITE OR LEGIT SITE,0.04008658,,,fake,giSyWeCyx4,Information/Guides,2014-10-03
1840,Hallucinogens and Culture,0.00264571,,Internet,captainkirk,giSyWeCyx4,Information/Guides,2014-10-03
1841,"the Stimulant Tolerance, Withdrawel and Neurotoxcity Prevention guide",0.06681097,,USA,stussy,giSyWeCyx4,Information/Guides,2014-10-03
1842,The Big Book of Secret Hiding Places,0.00264571,,Internet,captainkirk,giSyWeCyx4,Information/Guides,2014-10-03
1843,Cloning Credit Cards,0.02405195,,,fake,giSyWeCyx4,Information/Guides,2014-10-03
1844,"WHERE TO BUY STOLEN BANK , EBAY , PAYPAL ACCOUNTS",0.02672439,,,fake,giSyWeCyx4,Information/Guides,2014-10-03
1845,Davis's Pocket Clinical Drug Reference,0.00264571,,Internet,captainkirk,giSyWeCyx4,Information/Guides,2014-10-03
1846,Social Engineering: The Art of Human Hacking,0.00264571,,Internet,captainkirk,giSyWeCyx4,Information/Guides,2014-10-03
1847,FIGHT PAYPAL CHARGEBACK,0.02405195,,,fake,giSyWeCyx4,Information/Guides,2014-10-03
1848,"Make 500-1000 £ From Betfair, Risk Free, New System",0.13359523,,,passman,giSyWeCyx4,Information/Guides,2014-10-03
1849,Get ANY Apple product for free!,0.08014644,,,passman,giSyWeCyx4,Information/Guides,2014-10-03
1850,(Two Guides) Easy Mephedrone 4mmc Synthesis,0.04005986,,,passman,giSyWeCyx4,Information/Guides,2014-10-03
1851,"Cardable Sites List, Hundreds Of Sites",0.02669766,,,passman,giSyWeCyx4,Information/Guides,2014-10-03
1852,PIN RECOVERY ATTACKS,0.04008658,,,fake,giSyWeCyx4,Information/Guides,2014-10-03
1853,Long Term Carding Method With An Anonymous Website,0.05342205,,,passman,giSyWeCyx4,Information/Guides,2014-10-03
1854,One Pot Shake and Bake Meth Cooking,0.00264571,,Internet,captainkirk,giSyWeCyx4,Information/Guides,2014-10-03
1855,Highly profitable Business ideas,0.13362195,,,cyberzen,giSyWeCyx4,Information/Guides,2014-10-03
1856,WHERE TO BUY DUMPS CVVs BINS,0.02405195,,,fake,giSyWeCyx4,Information/Guides,2014-10-03
1857,A Guidebook To The Psilocybin Mushrooms Of Mexico,0.00264571,,Internet,captainkirk,giSyWeCyx4,Information/Guides,2014-10-03
1858,Say goodbye to burner phones,0.02672439,,,fake,giSyWeCyx4,Information/Guides,2014-10-03
1859,"Artful Persuasion: How to Command Attention, Change Minds, and Influence People",0.00264571,,Internet,captainkirk,giSyWeCyx4,Information/Guides,2014-10-03
1860,Paypal + Ebay info package for stealth and scamming,0.03046580,,,starlight,giSyWeCyx4,Information/Guides,2014-10-03
1861,How TO MAKE SILENT SMS - PING SMS to know when a gsm is on,0.01336219,,,fake,giSyWeCyx4,Information/Guides,2014-10-03
1862,Pimpology: The 48 Laws of the Game,0.00264571,,Internet,captainkirk,giSyWeCyx4,Information/Guides,2014-10-03
1863,Easiest Method Of Checking CC's and Dumps,0.02669766,,,passman,giSyWeCyx4,Information/Guides,2014-10-03
1864,Cell Phone Tracking,0.01068975,,,cyberzen,giSyWeCyx4,Information/Guides,2014-10-03
1865,HOW TO HACK ANY FACEBOOK ACCOUNT EASY,0.04005986,,,passman,giSyWeCyx4,Information/Guides,2014-10-03
1866,Carding Dell Tutorial (Noob Friendly),0.01333547,,,passman,giSyWeCyx4,Information/Guides,2014-10-03
1867,"How To Make Between $55-$220 Per Hour or $10,000 a Week",0.05344878,,rland,Aracay,giSyWeCyx4,Information/Guides,2014-10-03
1868,"WEB TRACKING METHODS, AND HOW TO AVOID IT",0.01336219,,,fake,giSyWeCyx4,Information/Guides,2014-10-03
1869,HOW COMPUTER FORENSICS WORK,0.01870707,,,fake,giSyWeCyx4,Information/Guides,2014-10-03
1870,Cruise Tips and Tricks,0.02405195,,,fake,giSyWeCyx4,Information/Guides,2014-10-03
1871,(100% Unique) How To Pass Counterfeit Money 2 Guides,0.04005986,,,passman,giSyWeCyx4,Information/Guides,2014-10-03
1872,Create and Maintain an Anonymous Identity Online,0.01603463,,,fake,giSyWeCyx4,Information/Guides,2014-10-03
1873,2 Freelancer Cashout Methods,0.01333547,,,passman,giSyWeCyx4,Information/Guides,2014-10-03
1874,"A Dictionary of Cantonese Slang: Language of Hong Kong Movies, Street Gangs and City Life",0.00264571,,Internet,captainkirk,giSyWeCyx4,Information/Guides,2014-10-03
1875,U.S LOAN FRAUD TUTORIAL,0.07750073,,,fake,giSyWeCyx4,Information/Guides,2014-10-03
1876,The Natural Penis Enlargement Guide,0.00801731,,USA,optiman,giSyWeCyx4,Information/Guides,2014-10-03
1877,Origins: The Quest for Our Cosmic Roots,0.00264571,,Internet,captainkirk,giSyWeCyx4,Information/Guides,2014-10-03
1878,50+ Carding Guides,0.02137951,,,sambalam8,giSyWeCyx4,Information/Guides,2014-10-03
1879,Homemade C-4 Guide - Paladin Press,0.00668109,,USA,optiman,giSyWeCyx4,Information/Guides,2014-10-03
1880,WI-FOO The definitive guide to penetrating and defending wireless,0.01870707,,,fake,giSyWeCyx4,Information/Guides,2014-10-03
1881,Beyond Positive Thinking,0.00264571,,Internet,captainkirk,giSyWeCyx4,Information/Guides,2014-10-03
1882,[NEW] Get Free TV's from Philips - GUIDE,0.05342205,,,passman,giSyWeCyx4,Information/Guides,2014-10-03
1883,[Android] Security And Anonimity,0.01068975,,,cyberzen,giSyWeCyx4,Information/Guides,2014-10-03
1884,How To Get A Free US Online Number,0.04005986,,,passman,giSyWeCyx4,Information/Guides,2014-10-03
1885,How to Get Stuff Cheap & Fun Things to Do At a Mall,0.01870707,,rland,Aracay,giSyWeCyx4,Information/Guides,2014-10-03
1886,Make Fast Cash - Blackhat Method,0.04008658,,rland,Aracay,giSyWeCyx4,Information/Guides,2014-10-03
1887,Stealth Paypal Account guide how to Withdraw  + 1 laundering method,0.01336219,,rland,businessdude,giSyWeCyx4,Information/Guides,2014-10-03
1888,"Acid Dreams: The Complete Social History of LSD: The CIA, the Sixties, and Beyond",0.00264571,,Internet,captainkirk,giSyWeCyx4,Information/Guides,2014-10-03
1889,Carding Tutorials Collection 50+ Tutorials,0.05342205,,,passman,giSyWeCyx4,Information/Guides,2014-10-03
1890,Anonymization,0.00264571,,Internet,captainkirk,giSyWeCyx4,Information/Guides,2014-10-03
1891,Practical LSD Manufacture 3rd edition,0.00264571,,Internet,captainkirk,giSyWeCyx4,Information/Guides,2014-10-03
1892,ULTIMATE LIVER CLEANSE FLUSH,0.01870707,,,fake,giSyWeCyx4,Information/Guides,2014-10-03
1893,How use 201 dumps in Chip Country,0.02672439,,,fake,giSyWeCyx4,Information/Guides,2014-10-03
1894,5 Unique And Easy Ways To Make a Living Online 2014,0.02669766,,,passman,giSyWeCyx4,Information/Guides,2014-10-03
1895,18 Extensions For Turning Firefox Into a Penetration Testing Tool,0.01603463,,,fake,giSyWeCyx4,Information/Guides,2014-10-03
1896,4 CC PAYPAL CASHOUT METHODS JUNE 2014,0.53448782,,,fake,giSyWeCyx4,Information/Guides,2014-10-03
1897,Recreational Drug Manufacturing - Organic Chemistry,0.00264571,,Internet,captainkirk,giSyWeCyx4,Information/Guides,2014-10-03
1898,NEW!! CC to BTC May 2014 + 4 Bonus Guides,0.09350864,,,passman,giSyWeCyx4,Information/Guides,2014-10-03
1899,HUGE Blackmarket Contact List,0.08014644,,,passman,giSyWeCyx4,Information/Guides,2014-10-03
1900,Asking the Right Questions: A Guide to Critical Thinking,0.00264571,,Internet,captainkirk,giSyWeCyx4,Information/Guides,2014-10-03
1901,Top 10 Websites To Search For People Online,0.01336219,,,fake,giSyWeCyx4,Information/Guides,2014-10-03
1902,Free Netflix For Life In 3 Simple Steps,0.05342205,,,passman,giSyWeCyx4,Information/Guides,2014-10-03
1903,The FREE Xbox One Detailed Tutorial,0.05342205,,,passman,giSyWeCyx4,Information/Guides,2014-10-03
1904,COMMUNICATIONS (CLANDESTINE),0.01068975,,,fake,giSyWeCyx4,Information/Guides,2014-10-03
1905,How To Remove Money From A Limnited Paypal,0.04005986,,,passman,giSyWeCyx4,Information/Guides,2014-10-03
1906,5 Ways to Cash out BTC,0.13362195,,Internet,funnyreeferman,giSyWeCyx4,Information/Guides,2014-10-03
1907,Zeus Setup Advanced Tutorial,0.02672439,,,fake,giSyWeCyx4,Information/Guides,2014-10-03
1908,EMAIL ALIASES UNLIMITED,0.01336219,,,fake,giSyWeCyx4,Information/Guides,2014-10-03
1909,The Art of Making Money: The Story of a Master Counterfeiter,0.00264571,,Internet,captainkirk,giSyWeCyx4,Information/Guides,2014-10-03
1910,How to Be Invisible,0.00264571,,Internet,captainkirk,giSyWeCyx4,Information/Guides,2014-10-03
1911,New MMO Carding Method (May 2014)!!!,0.02669766,,,passman,giSyWeCyx4,Information/Guides,2014-10-03
1912,Learn how to be completely 100% anonymous,0.00534487,,YourPM,xxSNOWxx,giSyWeCyx4,Information/Guides,2014-10-03
1913,Performing PayPal Transfers [DIY],0.05344878,,,passman,giSyWeCyx4,Information/Guides,2014-10-03
1914,Make £60+  per hour from a Gambling / gaming Site,0.66810978,,,autosafe,giSyWeCyx4,Information/Guides,2014-10-03
1915,RICH DAD Properties in Probate Training,0.40086587,,,RichDadPoorDad,giSyWeCyx4,Information/Guides,2014-10-03
1916,eBook How to Make $300 Easy - How To Make Money PDF,0.07215585,,Italy,gaioso,giSyWeCyx4,Information/Guides,2014-10-03
1917,HOW PREVENT A DNS LEAK WHEN USING VPN,0.02672439,,rland,Hackyboy,giSyWeCyx4,Information/Guides,2014-10-03
1918,All About Auto-Flowering Cannabis,0.00400865,,,ProfesorGreen,giSyWeCyx4,Information/Guides,2014-10-03
1919,Stansberry Research Options Training,0.13362195,,Internet,RichDadPoorDad,giSyWeCyx4,Information/Guides,2014-10-03
1920,Jordon Belfort - Straight Line Persuasion,0.26724391,,,RichDadPoorDad,giSyWeCyx4,Information/Guides,2014-10-03
1921,Cheap Diesel Fuel,0.13362195,,,autosafe,giSyWeCyx4,Information/Guides,2014-10-03
1922,Become an American Citizen,2.67243913,,,happyday,giSyWeCyx4,Information/Guides,2014-10-03
1923,eBook How to Make $200+ Daily - How To Make Money PDF,0.06146610,,Italy,gaioso,giSyWeCyx4,Information/Guides,2014-10-03
1924,eBook How to Make $100+ Daily - How To Make Money PDF,0.05077634,,Italy,gaioso,giSyWeCyx4,Information/Guides,2014-10-03
1925,eBook How to Make $100+ in 10 Mins Daily - How To Make Money PDF,0.05077634,,Italy,gaioso,giSyWeCyx4,Information/Guides,2014-10-03
1926,BETFAIR £300-£700 GAIN RISK FREE **2013** 100 % WORKING,0.05500000,,,autosafe,giSyWeCyx4,Information/Guides,2014-10-03
1927,eBook How to Make $10+ Daily - How To Make Money,0.02672439,,Italy,gaioso,giSyWeCyx4,Information/Guides,2014-10-03
1928,eBook How to Make $250+ Daily - How To Make Money PDF,0.06681097,,Italy,gaioso,giSyWeCyx4,Information/Guides,2014-10-03
1929,eBook How to get free stuff from Amazon - Everything! - How To Make Money PDF,0.06681097,,Italy,gaioso,giSyWeCyx4,Information/Guides,2014-10-03
1930,eBook How to Make $100 - $370 + Daily - How To Make Money PDF,0.05344878,,Italy,gaioso,giSyWeCyx4,Information/Guides,2014-10-03
1931,MEGA CARDING COLLECTON OF 63 TUTORIALS WORTH 100$,0.09353536,,rland,freestylerfreak13a,giSyWeCyx4,Information/Guides,2014-10-03
1932,How to cook Meth  in German but easy translate,0.02137951,,rland,freestylerfreak13a,giSyWeCyx4,Information/Guides,2014-10-03
1933,Lysergic Acid Production Guide,0.93535369,,,RPFan,giSyWeCyx4,Information/Guides,2014-10-03
1934,Big List of Onion Sites,0.01870707,,rland,freestylerfreak13a,giSyWeCyx4,Information/Guides,2014-10-03
1935,Post your drugs and other goods FREE via Royal Mail - Next Day Tracked - 1st Class + MORE !,0.02000000,,rland,easilydone,giSyWeCyx4,Information/Guides,2014-10-03
1936,Invite codes for Marketplaces,0.00267243,,rland,freestylerfreak13a,giSyWeCyx4,Information/Guides,2014-10-03
1937,1 STEALTH PAYPAL ACCOUNT CREATION GUIDE AND HOW TO WITHDRAW,0.04008658,,,freestylerfreak13a,giSyWeCyx4,Information/Guides,2014-10-03
1938,Amphetamine sulphate easy to cook with OTC (Over the Counter Products) in German,0.04008658,,,freestylerfreak13a,giSyWeCyx4,Information/Guides,2014-10-03
1939,The Art of Drug Smuggling,0.03474170,,rland,freestylerfreak13a,giSyWeCyx4,Information/Guides,2014-10-03
1940,Drug Smugglers on Drug Smuggling: Lessons from the Inside,0.03206926,,torland,freestylerfreak13a,giSyWeCyx4,Information/Guides,2014-10-03
1941,PayPal Transfers/Cashout,0.53448782,,rland,HellMaker,giSyWeCyx4,Information/Guides,2014-10-03
1942,How to get ~100$ from CC online,0.02669766,,,passman,giSyWeCyx4,Information/Guides,2014-10-03
1943,DMT The Spirit Molecule - Rick Strassman,0.00264571,,Internet,captainkirk,giSyWeCyx4,Information/Guides,2014-10-03
1944,Anarchists Cookbook,0.00414000,,rland,KryptykOG,giSyWeCyx4,Information/Guides,2014-10-03
1945,Penis Enlargement Guide,0.01068975,,,cyberzen,giSyWeCyx4,Information/Guides,2014-10-03
1946,Improvised Weapons of the American Underground,0.00264571,,Internet,captainkirk,giSyWeCyx4,Information/Guides,2014-10-03
1947,How to access I2p sites,0.01870707,,,fake,giSyWeCyx4,Information/Guides,2014-10-03
1948,All Silk Road's and Agora's Money Making Methods & Guides,0.21379513,,,cyberzen,giSyWeCyx4,Information/Guides,2014-10-03
1949,Self Sufficiency for the 21st Century,0.00264571,,Internet,captainkirk,giSyWeCyx4,Information/Guides,2014-10-03
1950,PGP & GPG: Email for the Practical Paranoid,0.00264571,,Internet,captainkirk,giSyWeCyx4,Information/Guides,2014-10-03
1951,How To Check Dumps Without Killing Them,0.02669766,,,passman,giSyWeCyx4,Information/Guides,2014-10-03
1952,Marijuana Horticulture: The Indoor/Outdoor Medical Grower's Bible,0.00516000,,rland,KryptykOG,giSyWeCyx4,Information/Guides,2014-10-03
1953,892 Best & Working Bin List,0.04008658,,rland,Aracay,giSyWeCyx4,Information/Guides,2014-10-03
1954,269 Amazing Sex Tips and Tricks for Him,0.01068975,,,cyberzen,giSyWeCyx4,Information/Guides,2014-10-03
1955,Firefox Setup For Extreme Privacy,0.01068975,,,cyberzen,giSyWeCyx4,Information/Guides,2014-10-03
1956,Bank Transfers For Beginners,0.05342205,,,passman,giSyWeCyx4,Information/Guides,2014-10-03
1957,Increase Sperm Count NATURALLY,0.01068975,,,cyberzen,giSyWeCyx4,Information/Guides,2014-10-03
1958,Negotiate to Win: The 21 Rules for Successful Negotiating,0.00264571,,Internet,captainkirk,giSyWeCyx4,Information/Guides,2014-10-03
1959,A MAC ADDRESS CHANGER SOFTWARE FOR MAC OS,0.01068975,,,cyberzen,giSyWeCyx4,Information/Guides,2014-10-03
1960,QUIT OPIOIDS WITHOUT WITHDRAWAL SYMPTOMS,0.01870707,,,fake,giSyWeCyx4,Information/Guides,2014-10-03
1961,"1,001 Facts that Will Scare the Shit Out of You: The Ultimate Bathroom Reader",0.00264571,,Internet,captainkirk,giSyWeCyx4,Information/Guides,2014-10-03
1962,Homemade Guns And Homemade Ammo,0.00264571,,Internet,captainkirk,giSyWeCyx4,Information/Guides,2014-10-03
1963,FREE UK AND SPAIN PHONE NUMBERS,0.01870707,,,fake,giSyWeCyx4,Information/Guides,2014-10-03
1964,The Alien Invasion Survival Handbook,0.00264571,,Internet,captainkirk,giSyWeCyx4,Information/Guides,2014-10-03
1965,EU Citizenship Complete Information,0.05344878,,rland,Aracay,giSyWeCyx4,Information/Guides,2014-10-03
1966,Check CC Limit For FREE Tutorial,0.02669766,,,passman,giSyWeCyx4,Information/Guides,2014-10-03
1967,Running A Successful + Profitable Gambling Ring,0.00264571,,,passman,giSyWeCyx4,Information/Guides,2014-10-03
1968,The Do-it-Yourself Gunpowder Cookbook,0.00264571,,Internet,captainkirk,giSyWeCyx4,Information/Guides,2014-10-03
1969,Get to the Top on Google: Tips and Techniques,0.00264571,,Internet,captainkirk,giSyWeCyx4,Information/Guides,2014-10-03
1970,97 Easy Money Savers...Save your way to a personal fortune!,0.02672439,,rland,Aracay,giSyWeCyx4,Information/Guides,2014-10-03
1971,Sneak it Through - Smuggling Made Easier,0.00250000,,rland,KryptykOG,giSyWeCyx4,Information/Guides,2014-10-03
1972,"Ebay Auctions Theft, Make Money From Other Peoples Listings",0.02669766,,,passman,giSyWeCyx4,Information/Guides,2014-10-03
1973,ANY STEROID FROM E.U,0.01336219,,,fake,giSyWeCyx4,Information/Guides,2014-10-03
1974,HUGE Making Money Ebook Collection,0.01333547,,,passman,giSyWeCyx4,Information/Guides,2014-10-03
1975,AMAZON REFUND METHOD,0.01603463,,,fake,giSyWeCyx4,Information/Guides,2014-10-03
1976,FINGERPRINTING TUTORIAL - MAKE FAKE FINGERPRINT,0.02672439,,,fake,giSyWeCyx4,Information/Guides,2014-10-03
1977,REAL Genuine USA Identity Set Guide,0.21112269,,,starlight,giSyWeCyx4,Information/Guides,2014-10-03
1978,Dark Mission: The Secret History of NASA,0.00264571,,Internet,captainkirk,giSyWeCyx4,Information/Guides,2014-10-03
1979,Collection of 10 eBooks that will help you with girls - BEST OFFER!,0.04008658,,Internet,optiman,giSyWeCyx4,Information/Guides,2014-10-03
1980,Stash Your Swag: 100 Secret Hiding Places,0.00264571,,Internet,captainkirk,giSyWeCyx4,Information/Guides,2014-10-03
1981,Make Your Own LSD in 10 Easy Steps!,0.02672439,,rland,Aracay,giSyWeCyx4,Information/Guides,2014-10-03
1982,Breaking VISA PIN,0.02672439,,,fake,giSyWeCyx4,Information/Guides,2014-10-03
1983,The World According to Monsanto,0.00264571,,Internet,captainkirk,giSyWeCyx4,Information/Guides,2014-10-03
1984,What NASA Isn't Telling You About Mars,0.00264571,,Internet,captainkirk,giSyWeCyx4,Information/Guides,2014-10-03
1985,PASS COUNTERFEIT MONEY,0.02672439,,,fake,giSyWeCyx4,Information/Guides,2014-10-03
1986,50 Ways To Succeed - Make Money,0.00801731,,,fake,giSyWeCyx4,Information/Guides,2014-10-03
1987,BASICS OF A CON ( OR SCAM ),0.01336219,,,fake,giSyWeCyx4,Information/Guides,2014-10-03
1988,Physics of the Impossible,0.00264571,,Internet,captainkirk,giSyWeCyx4,Information/Guides,2014-10-03
1989,Carding Tutorials 230 Pages!!!,0.13359523,,,passman,giSyWeCyx4,Information/Guides,2014-10-03
1990,PayPal Stealth Accounts - The Latest Working Methods,0.04008658,,Internet,MagicHat,giSyWeCyx4,Information/Guides,2014-10-03
1991,Critical Thinking Skills Success in 20 Minutes a Day,0.00264571,,Internet,captainkirk,giSyWeCyx4,Information/Guides,2014-10-03
1992,How To Make Paypal Middleman/Cashout Accounts,0.05344878,,,passman,giSyWeCyx4,Information/Guides,2014-10-03
1993,Mindfucking: A Critique of Mental Manipulation,0.00264571,,Internet,captainkirk,giSyWeCyx4,Information/Guides,2014-10-03
1994,MDA MDMA Amphetamine Ecstasy Cooking Synthesis Guide,0.02258211,,Internet,starlight,giSyWeCyx4,Information/Guides,2014-10-03
1995,How To Talk So People Listen: The Real Key to Job Success,0.00264571,,Internet,captainkirk,giSyWeCyx4,Information/Guides,2014-10-03
1996,CLOSING FACEBOOK ACCOUNTS - NOOB FRIENDLY,0.01870707,,,fake,giSyWeCyx4,Information/Guides,2014-10-03
1997,Home Repair Handbook,0.00264571,,Internet,captainkirk,giSyWeCyx4,Information/Guides,2014-10-03
1998,"EMP GENERATOR SCHEMATICS + BUILT GUIDE , SLOT SCAM",0.01336219,,,fake,giSyWeCyx4,Information/Guides,2014-10-03
1999,Sneak It Through: Smuggling Made Easier,0.00264571,,Internet,captainkirk,giSyWeCyx4,Information/Guides,2014-10-03
2000,Arrest Proof Yourself,0.00264571,,Internet,captainkirk,giSyWeCyx4,Information/Guides,2014-10-03
2001,Social Engineering: The Art of Human Hacking,0.00302000,,rland,KryptykOG,giSyWeCyx4,Information/Guides,2014-10-03
2002,"Securing Iphone , Ipad -TUTORIAL",0.02405195,,rland,fake,giSyWeCyx4,Information/Guides,2014-10-03
2003,RICH DAD Mobile Homes & RV Parks,0.53448782,,,RichDadPoorDad,giSyWeCyx4,Information/Guides,2014-10-03
2004,How to cashout CC's with anon. credit cards,0.04008658,,EU,Hackyboy,giSyWeCyx4,Information/Guides,2014-10-03
2005,How to use PGP,0.02672439,,,Hackyboy,giSyWeCyx4,Information/Guides,2014-10-03
2006,MAC ADRESS CHANGER FOR WINDOWS + TUTO,0.02672439,,,Hackyboy,giSyWeCyx4,Information/Guides,2014-10-03
2007,HOW TO USE SOCKS5,0.01336219,,Internet,RastainPeace,giSyWeCyx4,Information/Guides,2014-10-03
2008,Turn any LINUX into proxy socks5,0.02672439,,,Hackyboy,giSyWeCyx4,Information/Guides,2014-10-03
2009,Buy Cannabis Seeds Online,0.00320692,,,ProfesorGreen,giSyWeCyx4,Information/Guides,2014-10-03
2010,Paypal Stealth,0.05344878,,,Hackyboy,giSyWeCyx4,Information/Guides,2014-10-03
2011,Cell phone tracking,0.09353536,,,fake,giSyWeCyx4,Information/Guides,2014-10-03
2012,How to profit illegally from Bitcoin,0.01603463,,,fake,giSyWeCyx4,Information/Guides,2014-10-03
2013,How to make a girl squirt,0.02672439,,,fake,giSyWeCyx4,Information/Guides,2014-10-03
2014,HOW TO GET UNLIMITED PHONE NUMBERS,0.04008658,,,fake,giSyWeCyx4,Information/Guides,2014-10-03
2015,GUIDE TO POSTAL SMUGGLING,0.04008658,,rland,Hackyboy,giSyWeCyx4,Information/Guides,2014-10-03
2016,Every Possible Way to Generate Web Traffic,0.01603463,,,fake,giSyWeCyx4,Information/Guides,2014-10-03
2017,5 ATM HACKING TUTORIAL,0.09353536,,rland,fake,giSyWeCyx4,Information/Guides,2014-10-03
2018,CARD PRINTING TUTORIAL,0.02672439,,,fake,giSyWeCyx4,Information/Guides,2014-10-03
2019,60+ Cardnig Tutorials + Cashing out VIDEO,0.08017317,,,Dipsy,giSyWeCyx4,Information/Guides,2014-10-03
2020,Leaked: Comprehensive Paypal Guide,0.02405195,,,fake,giSyWeCyx4,Information/Guides,2014-10-03
2021,Create a Realistic Credit Card in Photoshop,0.00534487,,,fake,giSyWeCyx4,Information/Guides,2014-10-03
2022,"Easy Way To Move Offshore, Change Your Identity And Never Pay Tax Again",0.02672439,,,fake,giSyWeCyx4,Information/Guides,2014-10-03
2023,Instructions How to Make Geltabs,0.21379513,,,Fappy,giSyWeCyx4,Information/Guides,2014-10-03
2024,HOW TO DELETE NEGATIVE FEEDBACK & GET RID OF YOUR COMPETITORS ON EBAY,0.04008658,,,fake,giSyWeCyx4,Information/Guides,2014-10-03
2025,***how to pick the right wife ***,0.04005986,,rland,smart666tiger,giSyWeCyx4,Information/Guides,2014-10-03
2026,All Money Making Methods & Guides(LIMITED OFFER) PROMO PRICE,0.00534487,,,montana1933,giSyWeCyx4,Information/Guides,2014-10-03
2027,Complete tutorial on hacking Paypal accounts,0.05344878,,,Hackyboy,giSyWeCyx4,Information/Guides,2014-10-03
2028,Ebay scam Get anything free from ebay,0.00400865,,Internet,montana1933,giSyWeCyx4,Information/Guides,2014-10-03
2029,Setting Up a Wifi Access Point and Dealing With SSL,0.02672439,,,fake,giSyWeCyx4,Information/Guides,2014-10-03
2030,CASHOUT METOD,0.04008658,,,fake,giSyWeCyx4,Information/Guides,2014-10-03
2031,LIST OF CARDABLE MMO + CURRENCIES,0.04008658,,,Hackyboy,giSyWeCyx4,Information/Guides,2014-10-03
2032,The Coupon Making Lessons by PurpleLotus v2.0,0.50776343,,rland,ThePurpleLotus,giSyWeCyx4,Information/Guides,2014-10-03
2033,Carding With Dumps Tutorials,0.02669766,,,passman,giSyWeCyx4,Information/Guides,2014-10-03
2034,Interview Magic: Job Interview Secrets from America's Career and Life Coach,0.00264571,,Internet,captainkirk,giSyWeCyx4,Information/Guides,2014-10-03
2035,"Free VPN For Windows, Mac & Linux",0.01068975,,,cyberzen,giSyWeCyx4,Information/Guides,2014-10-03
