,name,price(BTC),from,to,vendor,cat_hash,cat,date
677,Fake California Drivers License - Holograms/UV/Swipes,0.73492076,,EU,flawlessfakeids,cM5k9R62Ni,Forgeries/Physical documents,2014-10-03
678,Fake Netherlands (Dutch) National ID Card - High quality Replica,1.02888906,,EU,flawlessfakeids,cM5k9R62Ni,Forgeries/Physical documents,2014-10-03
679,Fake UK Driving Licence - 1:1 Bank Quality Replica,1.02888906,,EU,flawlessfakeids,cM5k9R62Ni,Forgeries/Physical documents,2014-10-03
680,EU Drivers License (Physical - Not Scans),1.73708543,,World,Aracay,cM5k9R62Ni,Forgeries/Physical documents,2014-10-03
681,Fake Lithuanian ID Card,0.54785002,,EU,gork,cM5k9R62Ni,Forgeries/Physical documents,2014-10-03
682,France Physical Passport + DL + ID CARD,6.68109783,,rland,FakeMarket,cM5k9R62Ni,Forgeries/Physical documents,2014-10-03
683,Fake Lithuanian Drivers License,0.54785002,,EU,gork,cM5k9R62Ni,Forgeries/Physical documents,2014-10-03
684,Australia Physical Passport + DL + ID CARD,6.68109783,,rland,FakeMarket,cM5k9R62Ni,Forgeries/Physical documents,2014-10-03
685,Fake Lithuanian Passport,2.20476228,,EU,gork,cM5k9R62Ni,Forgeries/Physical documents,2014-10-03
686,"EU, Asian, & African Government Issued Passports",8.01731740,,World,Aracay,cM5k9R62Ni,Forgeries/Physical documents,2014-10-03
687,Fake French Driving Licence - UV and OVI security features!,1.02888906,,EU,flawlessfakeids,cM5k9R62Ni,Forgeries/Physical documents,2014-10-03
688,Federal Law Enforcement Badges - Perfect Copies,1.20000000,,rland,space100...,cM5k9R62Ni,Forgeries/Physical documents,2014-10-03
689,Australian Fake ID 100 Points,1.87070739,,Australia,harveynorman,cM5k9R62Ni,Forgeries/Physical documents,2014-10-03
690,Half Price Promo - Australian Fake ID 100 Points,0.93535369,,World,harveynorman,cM5k9R62Ni,Forgeries/Physical documents,2014-10-03
691,KIT Patente Europea +Tessera sanitaria/Codice Fiscale,1.01552687,,Italy,fakeITA,cM5k9R62Ni,Forgeries/Physical documents,2014-10-03
692,Best Fake Diploma Part 1,1.06897565,,,hsytk,cM5k9R62Ni,Forgeries/Physical documents,2014-10-03
693,Credential Consultation - Part 1 of 3,0.50000000,,rland,space100...,cM5k9R62Ni,Forgeries/Physical documents,2014-10-03
694,Patente Italiana formato Europeo - Italian Driving License DL,0.53448782,,Italy,fakeITA,cM5k9R62Ni,Forgeries/Physical documents,2014-10-03
695,REAL Australian Fake ID - Victoria w/ Correct Holograms/UV,0.93535369,,Australia,harveynorman,cM5k9R62Ni,Forgeries/Physical documents,2014-10-03
696,Half Price Promo - REAL Australian Fake ID - Victoria w/ Correct Holograms/UV,0.46767684,,World,harveynorman,cM5k9R62Ni,Forgeries/Physical documents,2014-10-03
697,Tessera sanitaria/Codice Fiscale - Italian SSN,0.53448782,,Italy,fakeITA,cM5k9R62Ni,Forgeries/Physical documents,2014-10-03
698,Austria Drivers Licence,0.66810978,,,Mike,cM5k9R62Ni,Forgeries/Physical documents,2014-10-03
699,Fake UK Driving Licence and Paper Counterpart - 1:1 Bank Quality Replica,1.17587321,,EU,flawlessfakeids,cM5k9R62Ni,Forgeries/Physical documents,2014-10-03
700,Physical Social Security Number Card,0.53448782,,rland,FakeMarket,cM5k9R62Ni,Forgeries/Physical documents,2014-10-03
701,EU Passport 1:1 Superb quality,6.14661001,,EU,ThreeKings,cM5k9R62Ni,Forgeries/Physical documents,2014-10-03
702,Barazil Physical Passport + DL + ID CARD,4.14228065,,rland,FakeMarket,cM5k9R62Ni,Forgeries/Physical documents,2014-10-03
703,custom hotel booking,0.66810978,,,livinglarge,cM5k9R62Ni,Forgeries/Physical documents,2014-10-03
704,Lithuanian ID card SuperB quality,2.67243913,,EU,ThreeKings,cM5k9R62Ni,Forgeries/Physical documents,2014-10-03
705,Fake Italian Drivers Licence - 1:1 Bank Quality,1.02888906,,EU,flawlessfakeids,cM5k9R62Ni,Forgeries/Physical documents,2014-10-03
706,Fake German National ID Card (Personalausweis) - 1:1 Security features!,1.87070739,,EU,flawlessfakeids,cM5k9R62Ni,Forgeries/Physical documents,2014-10-03
707,Fake Irish Driving Licence - 1:1 Bank Quality Replica,1.02888906,,EU,flawlessfakeids,cM5k9R62Ni,Forgeries/Physical documents,2014-10-03
708,Fake Danish Passport,3.20692696,,EU,gork,cM5k9R62Ni,Forgeries/Physical documents,2014-10-03
709,Fake Lithuanian Passport (old version),5.09099655,,EU,gork,cM5k9R62Ni,Forgeries/Physical documents,2014-10-03
710,United Kingdom Physical Passport + DL + ID CARD,7.48282957,,rland,FakeMarket,cM5k9R62Ni,Forgeries/Physical documents,2014-10-03
711,Italian Drive License,0.66810978,,,AmicoFriz,cM5k9R62Ni,Forgeries/Physical documents,2014-10-03
712,Fake Italian National ID - 1:1 Bank Quality Replica,1.02888906,,EU,flawlessfakeids,cM5k9R62Ni,Forgeries/Physical documents,2014-10-03
713,Fake Lithuanian Drivers License (new version),1.41639274,,EU,gork,cM5k9R62Ni,Forgeries/Physical documents,2014-10-03
714,Belgium Physical Passport + DL + ID CARD,4.94401240,,rland,FakeMarket,cM5k9R62Ni,Forgeries/Physical documents,2014-10-03
715,EU Lithuanian driving license SuperB quality,2.67243913,,EU,ThreeKings,cM5k9R62Ni,Forgeries/Physical documents,2014-10-03
716,Fake Latvian drivers licence,1.09570004,,EU,gork,cM5k9R62Ni,Forgeries/Physical documents,2014-10-03
717,Latvia (EU) Drivers Licence,0.66810978,,,Mike,cM5k9R62Ni,Forgeries/Physical documents,2014-10-03
718,Fake French National ID - 1:1 Bank Quality Replica,1.60346348,,EU,flawlessfakeids,cM5k9R62Ni,Forgeries/Physical documents,2014-10-03
719,Customized Prescription Labels - Physical Label,0.20043293,,,space100...,cM5k9R62Ni,Forgeries/Physical documents,2014-10-03
720,EU Drivers License (Genuine and System Registered),13.36219567,,World,Aracay,cM5k9R62Ni,Forgeries/Physical documents,2014-10-03
721,Pysical Fake Passports and IDs,0.01336219,,rland,FakeMarket,cM5k9R62Ni,Forgeries/Physical documents,2014-10-03
722,German Physical Passport + DL + ID CARD,6.68109783,,rland,FakeMarket,cM5k9R62Ni,Forgeries/Physical documents,2014-10-03
723,Fake Diplomas For Worldwide Universities & Colleges,2.13795130,,World,Aracay,cM5k9R62Ni,Forgeries/Physical documents,2014-10-03
724,EU Citizenship & Residency ID Cards (Physical - Not Scans),1.73708543,,World,Aracay,cM5k9R62Ni,Forgeries/Physical documents,2014-10-03
725,Custom made stamp,0.21379513,,EU,gork,cM5k9R62Ni,Forgeries/Physical documents,2014-10-03
726,EU Passport 1:1 Good quality,4.00865870,,EU,ThreeKings,cM5k9R62Ni,Forgeries/Physical documents,2014-10-03
727,Fake Romanian National ID - 1:1 Bank Quality Replica,1.02888906,,EU,flawlessfakeids,cM5k9R62Ni,Forgeries/Physical documents,2014-10-03
728,French National ID Card,0.73492076,,World,Mike,cM5k9R62Ni,Forgeries/Physical documents,2014-10-03
729,Customized SSN Card - Physical Card,0.26724391,,USA,space100...,cM5k9R62Ni,Forgeries/Physical documents,2014-10-03
730,"University Degrees - USA, UK, DE, FR, SG",1.13578663,,World,Mike,cM5k9R62Ni,Forgeries/Physical documents,2014-10-03
731,Austrian National ID Card,0.66810978,,World,Mike,cM5k9R62Ni,Forgeries/Physical documents,2014-10-03
732,AUS VIC Drivers Licence,0.66810978,,World,Mike,cM5k9R62Ni,Forgeries/Physical documents,2014-10-03
733,REAL Genuine USA Identity Set Guide,0.21112269,,,starlight,cM5k9R62Ni,Forgeries/Physical documents,2014-10-03
734,French Drivers Licence,0.82845613,,World,Mike,cM5k9R62Ni,Forgeries/Physical documents,2014-10-03
735,Fake ID - South Carolina (SC) Driver's License [holo+uv+micro] [scans+bends],0.25388171,,USA,ident!ty,cM5k9R62Ni,Forgeries/Physical documents,2014-10-03
736,Custom IDs/DLs (PLEASE READ!),0.66810978,,World,Mike,cM5k9R62Ni,Forgeries/Physical documents,2014-10-03
737,Singapore Drivers Licence,0.66810978,,World,Mike,cM5k9R62Ni,Forgeries/Physical documents,2014-10-03
738,Spain Drivers Licence,0.66810978,,,Mike,cM5k9R62Ni,Forgeries/Physical documents,2014-10-03
739,Canada Permanent Resident Card,0.66810978,,World,Mike,cM5k9R62Ni,Forgeries/Physical documents,2014-10-03
740,Seychelles National ID Card,0.66810978,,,Mike,cM5k9R62Ni,Forgeries/Physical documents,2014-10-03
741,Get a New Identity- US Driver's License ID for White Male 40-50's,0.16034634,,USA,sunnysideup,cM5k9R62Ni,Forgeries/Physical documents,2014-10-03
742,BEST Quality Fake California ID Anywhere – Scan/UV/Bend Test/Holos,0.42759026,,Worldwide,AgentSmith008,cM5k9R62Ni,Forgeries/Physical documents,2014-10-03
743,Israel Drivers Licence,0.66810978,,World,Mike,cM5k9R62Ni,Forgeries/Physical documents,2014-10-03
744,Australia  SA Drivers Licence,0.66810978,,,Mike,cM5k9R62Ni,Forgeries/Physical documents,2014-10-03
745,NZ Firearms Licence,0.66810978,,,Mike,cM5k9R62Ni,Forgeries/Physical documents,2014-10-03
746,Drug Prescription Fillable at Pharmacy,0.08017317,,USA,cashflow,cM5k9R62Ni,Forgeries/Physical documents,2014-10-03
747,Australia  NSW Drivers Licence,0.53181538,,World,Mike,cM5k9R62Ni,Forgeries/Physical documents,2014-10-03
748,"US DRIVING LICENSES - All security features exact, all tests pass",0.78836954,,USA,space100...,cM5k9R62Ni,Forgeries/Physical documents,2014-10-03
749,New Jersey Fake ID,0.32069269,,USA,Good-IDs,cM5k9R62Ni,Forgeries/Physical documents,2014-10-03
750,Australia  WA Heavy Vehicle Drivers Licence,0.66810978,,,Mike,cM5k9R62Ni,Forgeries/Physical documents,2014-10-03
751,US/USA Birth Certificate,1.10906224,,USA,bumble701,cM5k9R62Ni,Forgeries/Physical documents,2014-10-03
752,Colorado Fake ID / All Security Features,0.26724391,,USA,DarkMark,cM5k9R62Ni,Forgeries/Physical documents,2014-10-03
753,Forged Doctor's Certificate - AU Only,0.06681097,,Australia,FearTheReaper,cM5k9R62Ni,Forgeries/Physical documents,2014-10-03
754,Canada Physical Passport + DL + ID CARD,6.68109783,,rland,FakeMarket,cM5k9R62Ni,Forgeries/Physical documents,2014-10-03
755,Finland Physical Passport + DL + ID CARD,4.94401240,,rland,FakeMarket,cM5k9R62Ni,Forgeries/Physical documents,2014-10-03
756,Pennsylvania Driver's License,0.53448782,,,RichPorter,cM5k9R62Ni,Forgeries/Physical documents,2014-10-03
757,Illinois Fake ID HOLO/UV/BEND/SCAN,75.00000000,,WorldWide,the_g0dfather,cM5k9R62Ni,Forgeries/Physical documents,2014-10-03
758,MSR206 magnetic card reader,0.53181538,,China,fake,vvKMDUoa1L,Counterfeits/Electronics,2014-10-03
759,beats pil,0.16034634,,Australia,shoeshunge,vvKMDUoa1L,Counterfeits/Electronics,2014-10-03
760,Telefonul anti interceptare,1.06630321,,,fake,vvKMDUoa1L,Counterfeits/Electronics,2014-10-03
761,Samsung Galaxy S5 - Quad Core (New!!),0.73492076,,HongKong,Mike,vvKMDUoa1L,Counterfeits/Electronics,2014-10-03
762,USB Portable Magnetic Stripe Card,0.79905930,,China,fake,vvKMDUoa1L,Counterfeits/Electronics,2014-10-03
763,SAMSUNG GALAXY 16 gb+ ANONYMOUS SIM CARD + TUTORIALS,0.26724391,,EU,fake,vvKMDUoa1L,Counterfeits/Electronics,2014-10-03
764,ANTI TAPPING FOR LANDLINES,0.10689756,,EU,fake,vvKMDUoa1L,Counterfeits/Electronics,2014-10-03
765,Samsung Galaxy Note 3 - Quad Core,1.05561345,,HongKong,Mike,vvKMDUoa1L,Counterfeits/Electronics,2014-10-03
766,Ford Rolling Code Grabber Opener,3.07330500,,World,autosafe,vvKMDUoa1L,Counterfeits/Electronics,2014-10-03
767,Urbeats By Dr. Dre Tour Earphones Earbuds For Iphone Ipad etc.(Super Replica),0.15767390,,China,Bigdeal100,vvKMDUoa1L,Counterfeits/Electronics,2014-10-03
768,STEALTH PHONE ANTI INTERCEPTION,0.88190491,,EU,fake,vvKMDUoa1L,Counterfeits/Electronics,2014-10-03
769,Design,0.22181244,,Netherlands,HigherGroundsNL,vvKMDUoa1L,Counterfeits/Electronics,2014-10-03
770,GSM GPS WIFI JAMMER,0.53448782,,China,fake,vvKMDUoa1L,Counterfeits/Electronics,2014-10-03
771,EMP PULSE GENERATOR,0.66810978,,China,fake,vvKMDUoa1L,Counterfeits/Electronics,2014-10-03
772,HOW TO OPEN AN ANONYMOUS POLISH BANK ACCOUNT,0.05344878,,rland,smart666tiger,vvKMDUoa1L,Counterfeits/Electronics,2014-10-03
773,EBAY SELLER ACCOUNT WITH 8 FEEDBACK,0.14698415,,rland,smart666tiger,vvKMDUoa1L,Counterfeits/Electronics,2014-10-03
774,ANONYMOUS CELL PHONE VOICE CHANGER,0.13362195,,EU,VendingSolutions,vvKMDUoa1L,Counterfeits/Electronics,2014-10-03
775,8GB All-In-One Online Privacy Device USB STICK,0.21379513,,Canada,fake,vvKMDUoa1L,Counterfeits/Electronics,2014-10-03
776,Counterfeit Apple iPhone 6 Clone Copy with Logo Brand Phone,0.40086587,,,gaioso,vvKMDUoa1L,Counterfeits/Electronics,2014-10-03
777,Counterfeit Samsung Galaxy S5 Clone Copy with Logo Brand Phone,0.40086587,,,gaioso,vvKMDUoa1L,Counterfeits/Electronics,2014-10-03
778,♚ ++++ FAKED PACKSTATION ++++ ♚ 24/7 ✍ ✉ ✌,0.49440124,,Germany,Packstation24,vvKMDUoa1L,Counterfeits/Electronics,2014-10-03
779,Chanel Lace Pump CH3761 Black,0.34207220,,China,Bigdeal100,XpMZAakr4w,Counterfeits/Clothing,2014-10-03
780,Diesel men jeans replica DI1-60,0.21914000,,China,Bigdeal100,XpMZAakr4w,Counterfeits/Clothing,2014-10-03
781,Gucci Reversible Belt with Interlocking G Buckle Replica,0.32069269,,,Bigdeal100,XpMZAakr4w,Counterfeits/Clothing,2014-10-03
782,Nike Air Jordan 11 Mens AAA Replica,0.18707073,,China,mindcrasher,XpMZAakr4w,Counterfeits/Clothing,2014-10-03
783,air yeezy 2 AAA Replica,0.24049279,,China,mindcrasher,XpMZAakr4w,Counterfeits/Clothing,2014-10-03
784,air yeezy 2 AAA Replica,0.24049279,,China,mindcrasher,XpMZAakr4w,Counterfeits/Clothing,2014-10-03
785,Gucci Mens High shoes AAA Replica,0.24051952,,China,mindcrasher,XpMZAakr4w,Counterfeits/Clothing,2014-10-03
786,2013 New Jordan 28 AAA Replica,0.29396830,,China,mindcrasher,XpMZAakr4w,Counterfeits/Clothing,2014-10-03
787,air yeezy 2 AAA Replica,0.24049279,,China,mindcrasher,XpMZAakr4w,Counterfeits/Clothing,2014-10-03
788,Gucci Mens High shoes AAA Replica,0.24051952,,China,mindcrasher,XpMZAakr4w,Counterfeits/Clothing,2014-10-03
789,air yeezy 2 AAA Replica,0.24049279,,China,mindcrasher,XpMZAakr4w,Counterfeits/Clothing,2014-10-03
790,Air Jordan 3.5 Mens Shoes AAA Replica,0.21379513,,China,mindcrasher,XpMZAakr4w,Counterfeits/Clothing,2014-10-03
791,Nike Air Jordan 11 Mens AAA Replica,0.18707073,,China,mindcrasher,XpMZAakr4w,Counterfeits/Clothing,2014-10-03
792,Gucci Mens High shoes AAA Replica,0.24051952,,Worldwide,mindcrasher,XpMZAakr4w,Counterfeits/Clothing,2014-10-03
793,POLO Mens Tracksuits,0.26721718,,China,mindcrasher,XpMZAakr4w,Counterfeits/Clothing,2014-10-03
794,Nike Air Jordan 11 Mens AAA Replica,0.18707073,,China,mindcrasher,XpMZAakr4w,Counterfeits/Clothing,2014-10-03
795,POLO Mens Tracksuits AAA Replica,0.26721718,,China,mindcrasher,XpMZAakr4w,Counterfeits/Clothing,2014-10-03
796,Nike Air Jordan 11 Mens AAA Replica,0.18707073,,China,mindcrasher,XpMZAakr4w,Counterfeits/Clothing,2014-10-03
797,air yeezy 2 AAA Replica,0.24049279,,China,mindcrasher,XpMZAakr4w,Counterfeits/Clothing,2014-10-03
798,Nike Air Jordan 11 Mens AAA Replica,0.18707073,,China,mindcrasher,XpMZAakr4w,Counterfeits/Clothing,2014-10-03
799,air yeezy 2 AAA Replica,0.24049279,,China,mindcrasher,XpMZAakr4w,Counterfeits/Clothing,2014-10-03
800,Air Jordan 3.5 Mens Shoes AAA Replica,0.21379513,,China,mindcrasher,XpMZAakr4w,Counterfeits/Clothing,2014-10-03
801,air yeezy 2 AAA Replica,0.24049279,,,mindcrasher,XpMZAakr4w,Counterfeits/Clothing,2014-10-03
802,POLO Mens Tracksuits AAA Replica,0.26721718,,China,mindcrasher,XpMZAakr4w,Counterfeits/Clothing,2014-10-03
803,Gucci Mens High shoes AAA Replica,0.24051952,,China,mindcrasher,XpMZAakr4w,Counterfeits/Clothing,2014-10-03
804,Christian Louboutin's AAA Replica,0.33402816,,China,mindcrasher,XpMZAakr4w,Counterfeits/Clothing,2014-10-03
805,GUCCI Mens Hoodie AAA Replica,0.18704401,,China,mindcrasher,XpMZAakr4w,Counterfeits/Clothing,2014-10-03
806,GUCCI Mens Hoodie AAA Replica,0.18704401,,China,mindcrasher,XpMZAakr4w,Counterfeits/Clothing,2014-10-03
807,air yeezy 2 AAA Replica,0.24049279,,China,mindcrasher,XpMZAakr4w,Counterfeits/Clothing,2014-10-03
808,Nike Air Jordan 11 Mens AAA Replica,0.18707073,,China,mindcrasher,XpMZAakr4w,Counterfeits/Clothing,2014-10-03
809,Christian Louboutin Louis Calf Sneakers Replica,0.48103904,,,Bigdeal100,XpMZAakr4w,Counterfeits/Clothing,2014-10-03
810,Canada Goose Montebello Parka Replica - Woman,0.40086587,,HongKong,Bigdeal100,XpMZAakr4w,Counterfeits/Clothing,2014-10-03
811,Alexander McQueen Summer wear men's short sleeve T-shirt (green/white/gray) MCQ6-55,0.17370854,,China,Bigdeal100,XpMZAakr4w,Counterfeits/Clothing,2014-10-03
812,PHILIPP PLEIN Skull quilted leather Jacket 0228,0.65474758,,,Bigdeal100,XpMZAakr4w,Counterfeits/Clothing,2014-10-03
813,Christian Louboutin  Rock and roll the metallic rivet Sneakers 1107(many color for chose),0.48103904,,,Bigdeal100,XpMZAakr4w,Counterfeits/Clothing,2014-10-03
814,D&G Faux Leather Biker Jacket for Man0195,0.66810978,,,Bigdeal100,XpMZAakr4w,Counterfeits/Clothing,2014-10-03
815,Alexander McQueen Summer wear men's short sleeve T-shirt (black/white/red) MCQ4-38,0.12827707,,China,Bigdeal100,XpMZAakr4w,Counterfeits/Clothing,2014-10-03
816,Alexander McQueen Summer wear men's short sleeve T-shirt (black/white/green) MCQ2-38,0.12827707,,China,Bigdeal100,XpMZAakr4w,Counterfeits/Clothing,2014-10-03
817,a customer listing for 0b1,1.04225126,,,Bigdeal100,XpMZAakr4w,Counterfeits/Clothing,2014-10-03
818,Nike Air Yeezy II Red October Version Replica,0.31534781,,China,Bigdeal100,XpMZAakr4w,Counterfeits/Clothing,2014-10-03
819,D&G Sneakers Replica,0.28862342,,,Bigdeal100,XpMZAakr4w,Counterfeits/Clothing,2014-10-03
820,Diesel men Straight Jeans replica-139,0.23517464,,,Bigdeal100,XpMZAakr4w,Counterfeits/Clothing,2014-10-03
821,Alexander McQueen Summer wear men's short sleeve T-shirt(black/blue)MCQ1-38,0.12827707,,China,Bigdeal100,XpMZAakr4w,Counterfeits/Clothing,2014-10-03
822,LV Zippy Wallet M60243 Replica,0.23784708,,HongKong,Bigdeal100,XpMZAakr4w,Counterfeits/Clothing,2014-10-03
823,a special customer listing for f**t,0.82845613,,,Bigdeal100,XpMZAakr4w,Counterfeits/Clothing,2014-10-03
824,PHILIPP PLEIN Summer wear men's short sleeve T-shirt 1-68,0.15767390,,,Bigdeal100,XpMZAakr4w,Counterfeits/Clothing,2014-10-03
825,a special listing for f,1.57673908,,,Bigdeal100,XpMZAakr4w,Counterfeits/Clothing,2014-10-03
826,CAVALLI  Summer wear men's short sleeve T-shirt  CAV3-52,0.15232903,,China,Bigdeal100,XpMZAakr4w,Counterfeits/Clothing,2014-10-03
827,Armani Business man suit Replica,0.52112563,,China,Bigdeal100,XpMZAakr4w,Counterfeits/Clothing,2014-10-03
828,Chanel Wallet Sheepskin Leather Replica 11-128 orange,0.21112269,,China,Bigdeal100,XpMZAakr4w,Counterfeits/Clothing,2014-10-03
829,Dsquared Sweaters For Men Replica 105a,0.20845025,,China,Bigdeal100,XpMZAakr4w,Counterfeits/Clothing,2014-10-03
830,Abercrombie & Fitch Summer wear men's short sleeve T-shirt (white/gray) AF1-48,0.18172586,,,Bigdeal100,XpMZAakr4w,Counterfeits/Clothing,2014-10-03
831,Gucci Horsebit Driver Shoes Replica,0.32069269,,,Bigdeal100,XpMZAakr4w,Counterfeits/Clothing,2014-10-03
832,LV Zipper Wallet M60017 Replica,0.23784708,,HongKong,Bigdeal100,XpMZAakr4w,Counterfeits/Clothing,2014-10-03
833,Burberry Polo Shirts Replica,0.18172586,,,Bigdeal100,XpMZAakr4w,Counterfeits/Clothing,2014-10-03
834,Nike Yeezy II Shoes Replica,0.31534781,,China,Bigdeal100,XpMZAakr4w,Counterfeits/Clothing,2014-10-03
835,Burberry Checked Cashmere Scarf Replica,0.18172586,,China,Bigdeal100,XpMZAakr4w,Counterfeits/Clothing,2014-10-03
836,Nike Air Jordan IV Shoes replica,0.25388171,,,Bigdeal100,XpMZAakr4w,Counterfeits/Clothing,2014-10-03
837,Canada Goose Casual jackets replica-225,0.34741708,,,Bigdeal100,XpMZAakr4w,Counterfeits/Clothing,2014-10-03
838,Amani men jeans replica AMA1-75,0.22181244,,China,Bigdeal100,XpMZAakr4w,Counterfeits/Clothing,2014-10-03
839,D&G men jeans replica DG5-73,0.20577781,,China,Bigdeal100,XpMZAakr4w,Counterfeits/Clothing,2014-10-03
840,Dsquared Short Sleeve T-Shirts For Men 85a,0.14698415,,China,Bigdeal100,XpMZAakr4w,Counterfeits/Clothing,2014-10-03
841,D&G men jeans replica DG3-73,0.21914000,,China,Bigdeal100,XpMZAakr4w,Counterfeits/Clothing,2014-10-03
842,Paul&Shark men jeans replica SH1-75,0.20043293,,China,Bigdeal100,XpMZAakr4w,Counterfeits/Clothing,2014-10-03
843,Burberry Classic Slipper For Man,0.29396830,,China,Bigdeal100,XpMZAakr4w,Counterfeits/Clothing,2014-10-03
844,Dsquared AAA Straight Jeans For Men replica,0.20043293,,China,Bigdeal100,XpMZAakr4w,Counterfeits/Clothing,2014-10-03
845,Diesel men jeans replica DI2-64,0.21112269,,China,Bigdeal100,XpMZAakr4w,Counterfeits/Clothing,2014-10-03
846,MiuMiu Sandals with 13 Auger diamond crystal high heels,0.33138245,,China,Bigdeal100,XpMZAakr4w,Counterfeits/Clothing,2014-10-03
847,Chanel Wallet Sheepskin Leather Replica 11-128 Black,0.21112269,,China,Bigdeal100,XpMZAakr4w,Counterfeits/Clothing,2014-10-03
848,New Style Chanel Iron Toe High Heel Women Sandle real leather Super AA1;1,0.33672733,,China,Bigdeal100,XpMZAakr4w,Counterfeits/Clothing,2014-10-03
849,Diesel Jeans #M4,0.21112269,,HongKong,Mike,XpMZAakr4w,Counterfeits/Clothing,2014-10-03
850,Paul&Shark elastic men jeans replica (white/black/yellow/orange/ creamy white/blue)SH3-85,0.23517464,,China,Bigdeal100,XpMZAakr4w,Counterfeits/Clothing,2014-10-03
851,Prada casual shoes for men,0.34207220,,China,Bigdeal100,XpMZAakr4w,Counterfeits/Clothing,2014-10-03
852,Hermes classic flip-flops for man,0.29396830,,China,Bigdeal100,XpMZAakr4w,Counterfeits/Clothing,2014-10-03
853,ORIGINAL VIBRAM FIVEFINGERS,0.16034634,,China,fake,XpMZAakr4w,Counterfeits/Clothing,2014-10-03
854,Dolce & Gabanna Sneakers (white),0.44095245,,HongKong,Mike,XpMZAakr4w,Counterfeits/Clothing,2014-10-03
855,"Louis Vuitton ""LV"" Sneakers (brown)",0.42759026,,HongKong,Mike,XpMZAakr4w,Counterfeits/Clothing,2014-10-03
856,Dolce & Gabbana horsehair with Soft leather shoes for man,0.29931318,,China,Bigdeal100,XpMZAakr4w,Counterfeits/Clothing,2014-10-03
857,Leather Louis Vuitton Sneakers (blue),0.46767684,,HongKong,Mike,XpMZAakr4w,Counterfeits/Clothing,2014-10-03
858,Chanel Round Heel Single Pumps in Sheepskin Leather pink top 1;1,0.33138245,,China,Bigdeal100,XpMZAakr4w,Counterfeits/Clothing,2014-10-03
859,Gucci leatherbelt(black/brown/white)G2-49,0.13362195,,China,Bigdeal100,XpMZAakr4w,Counterfeits/Clothing,2014-10-03
860,Dolce & Gabanna Jeans #M1,0.32069269,,HongKong,Mike,XpMZAakr4w,Counterfeits/Clothing,2014-10-03
861,Gucci leatherbelt(black/brown)G1-118,0.23517464,,China,Bigdeal100,XpMZAakr4w,Counterfeits/Clothing,2014-10-03
862,Giuseppe Zanotti type of word cingulated high-heeled shoes Replica G2-100,0.26724391,,China,Bigdeal100,XpMZAakr4w,Counterfeits/Clothing,2014-10-03
863,MiuMiu 3.5 Cm Platform Pump with 11.5cm diamond high heels,0.33405489,,China,Bigdeal100,XpMZAakr4w,Counterfeits/Clothing,2014-10-03
864,New Style Lv Casual flats for girls,0.30733050,,China,Bigdeal100,XpMZAakr4w,Counterfeits/Clothing,2014-10-03
865,Diesel Jeans #M1,0.21112269,,HongKong,Mike,XpMZAakr4w,Counterfeits/Clothing,2014-10-03
866,Armani Suits 95% Wool Replica Collection,0.73492076,,rland,AsianVixene,XpMZAakr4w,Counterfeits/Clothing,2014-10-03
867,Nike Free Run 5.0 V4 *Black & Red*,0.15767390,,China,meowtime,XpMZAakr4w,Counterfeits/Clothing,2014-10-03
868,Diesel Jeans #M2,0.21112269,,HongKong,Mike,XpMZAakr4w,Counterfeits/Clothing,2014-10-03
869,Nike Air Jordan 11 Mens AAA Replica,0.18707073,,China,mindcrasher,XpMZAakr4w,Counterfeits/Clothing,2014-10-03
870,air yeezy 2 AAA Replica,0.24049279,,China,mindcrasher,XpMZAakr4w,Counterfeits/Clothing,2014-10-03
871,GUCCI Mens Hoodie AAA Replica,0.18704401,,China,mindcrasher,XpMZAakr4w,Counterfeits/Clothing,2014-10-03
872,Nike Air yeezy2 West Mens Shoes AAA Replica,0.24051952,,China,mindcrasher,XpMZAakr4w,Counterfeits/Clothing,2014-10-03
873,Christian Louboutin's AAA Replica,0.33402816,,China,mindcrasher,XpMZAakr4w,Counterfeits/Clothing,2014-10-03
874,2013 New Jordan 28 AAA Replica,0.29396830,,China,mindcrasher,XpMZAakr4w,Counterfeits/Clothing,2014-10-03
875,Air Jordan 3.5 Mens Shoes AAA Replica,0.21379513,,China,mindcrasher,XpMZAakr4w,Counterfeits/Clothing,2014-10-03
876,GUCCI Mens Hoodie AAA Replica,0.18704401,,China,mindcrasher,XpMZAakr4w,Counterfeits/Clothing,2014-10-03
877,Nike Air Max 90 VT *Dark Gray*,0.15767390,,China,meowtime,XpMZAakr4w,Counterfeits/Clothing,2014-10-03
878,Nike Free Run 5.0 V4 *Gray & Black*,0.15767390,,China,meowtime,XpMZAakr4w,Counterfeits/Clothing,2014-10-03
879,Nike Free Run 3.02 *Olive Green*,0.15767390,,China,meowtime,XpMZAakr4w,Counterfeits/Clothing,2014-10-03
880,Nike Free Run 4.0 V3 *Fluro Orange*,0.15767390,,China,meowtime,XpMZAakr4w,Counterfeits/Clothing,2014-10-03
881,Nike Free Run 4.0 V2 *Black*,0.15767390,,China,meowtime,XpMZAakr4w,Counterfeits/Clothing,2014-10-03
882,Nike Roshe Run *Blue*,0.15767390,,China,meowtime,XpMZAakr4w,Counterfeits/Clothing,2014-10-03
883,Nike Free Run 4.0 V3 *Gray & Blue*,0.15767390,,China,meowtime,XpMZAakr4w,Counterfeits/Clothing,2014-10-03
884,Nike Free Run 4.0 V2 *Tobacco*,0.15767390,,China,meowtime,XpMZAakr4w,Counterfeits/Clothing,2014-10-03
885,Nike Air Max 90 VT *Slate*,0.15767390,,China,meowtime,XpMZAakr4w,Counterfeits/Clothing,2014-10-03
886,Nike Free Run 4.0 V3 *Navy Blue & Orange*,0.15767390,,China,meowtime,XpMZAakr4w,Counterfeits/Clothing,2014-10-03
887,Nike Air Max 90 VT *Blue-gray*,0.15767390,,China,meowtime,XpMZAakr4w,Counterfeits/Clothing,2014-10-03
888,Air Jordan 3.5 Mens Shoes AAA Replica,0.21379513,,China,mindcrasher,XpMZAakr4w,Counterfeits/Clothing,2014-10-03
889,Nike Free Run 4.0 V3 *Blue*,0.15767390,,China,meowtime,XpMZAakr4w,Counterfeits/Clothing,2014-10-03
890,Nike Free Run 4.0 V3 *Light Gray & Blue*,0.15767390,,China,meowtime,XpMZAakr4w,Counterfeits/Clothing,2014-10-03
891,Nike Free Run 3.02 *Black & Gold*,0.15767390,,China,meowtime,XpMZAakr4w,Counterfeits/Clothing,2014-10-03
892,Nike Free Run 3.02 *Slate*,0.15767390,,China,meowtime,XpMZAakr4w,Counterfeits/Clothing,2014-10-03
893,Nike Air Max 90 VT *Red*,0.15767390,,China,meowtime,XpMZAakr4w,Counterfeits/Clothing,2014-10-03
894,Nike Pepper Low *Black*,0.15767390,,China,meowtime,XpMZAakr4w,Counterfeits/Clothing,2014-10-03
895,Nike Air Max 90 VT *Navy blue*,0.15767390,,China,meowtime,XpMZAakr4w,Counterfeits/Clothing,2014-10-03
896,Polo Jacket Spring Autumn Replica,0.32069269,,rland,AsianVixene,XpMZAakr4w,Counterfeits/Clothing,2014-10-03
897,Nike Free Run 4.0 V3 *Green & Gray*,0.15767390,,China,meowtime,XpMZAakr4w,Counterfeits/Clothing,2014-10-03
