,name,price(BTC),from,to,vendor,cat_hash,cat,date
0,eBook How to Make $100+ Daily - How To Make Money PDF,0.05077634,,Italy,gaioso,JAmvyj8iBs,Information/eBooks,2014-10-03
1,eBook How to Make $100+ in 10 Mins Daily - How To Make Money PDF,0.05077634,,Italy,gaioso,JAmvyj8iBs,Information/eBooks,2014-10-03
2,The Anarchist Cookbook by William Powell,0.03474170,,rland,freestylerfreak13a,JAmvyj8iBs,Information/eBooks,2014-10-03
3,eBook How to Make $200+ Daily - How To Make Money PDF,0.06146610,,Italy,gaioso,JAmvyj8iBs,Information/eBooks,2014-10-03
4,eBook How to Make $250+ Daily - How To Make Money PDF,0.06681097,,Italy,gaioso,JAmvyj8iBs,Information/eBooks,2014-10-03
5,eBook How to Make $100 - $370 + Daily - How To Make Money PDF,0.05344878,,Italy,gaioso,JAmvyj8iBs,Information/eBooks,2014-10-03
6,Get Out of Jail FREE Card,2.67243913,,,happyday,JAmvyj8iBs,Information/eBooks,2014-10-03
7,Cashing out Bitcoin with Prepaid VISA Cards,0.05344878,,rland,freestylerfreak13a,JAmvyj8iBs,Information/eBooks,2014-10-03
8,eBook How to Double Your Money with Paypal - How To Make Money PDF,0.06681097,,Italy,gaioso,JAmvyj8iBs,Information/eBooks,2014-10-03
9,Uncle_Fester_-_Secrets_of_Methamphetamine_Manufacture_3rd_ed,0.04008658,,rland,freestylerfreak13a,JAmvyj8iBs,Information/eBooks,2014-10-03
10,Amphetamine synthesis from bitter almond oil,0.04008658,,rland,freestylerfreak13a,JAmvyj8iBs,Information/eBooks,2014-10-03
11,Amphetamine sulphate easy to cook with OTC (Over the Counter Products) in German,0.04008658,,rland,freestylerfreak13a,JAmvyj8iBs,Information/eBooks,2014-10-03
12,The Great Big Narcotics Cookbook,0.00500000,,rland,casinoking,JAmvyj8iBs,Information/eBooks,2014-10-03
13,40 unique ways to make money online,0.01870707,,rland,freestylerfreak13a,JAmvyj8iBs,Information/eBooks,2014-10-03
14,1 STEALTH PAYPAL ACCOUNT CREATION GUIDE AND HOW TO WITHDRAW,0.02672439,,,freestylerfreak13a,JAmvyj8iBs,Information/eBooks,2014-10-03
15,The Great Big Narcotics Cookbook,0.02672439,,rland,freestylerfreak13a,JAmvyj8iBs,Information/eBooks,2014-10-03
16,How to earn Bitcoins without Infections !!!,0.02672439,,rland,freestylerfreak13a,JAmvyj8iBs,Information/eBooks,2014-10-03
17,How I have made 100's of dollars over a week,0.05344878,,rland,freestylerfreak13a,JAmvyj8iBs,Information/eBooks,2014-10-03
18,eBay Method - 100% Working - NEW - Make Money From eBay FAST!,0.05344878,,rland,freestylerfreak13a,JAmvyj8iBs,Information/eBooks,2014-10-03
19,Haschisch Lexikon german,0.02137951,,rland,freestylerfreak13a,JAmvyj8iBs,Information/eBooks,2014-10-03
20,$ 500 EVERY DAY WITH FACEBOOK FAN PAGES,0.02672439,,rland,freestylerfreak13a,JAmvyj8iBs,Information/eBooks,2014-10-03
21,Arsenal of Improofed Weapons,0.01068975,,rland,freestylerfreak13a,JAmvyj8iBs,Information/eBooks,2014-10-03
22,How to make $50 A DAY with CPC,0.05344878,,rland,freestylerfreak13a,JAmvyj8iBs,Information/eBooks,2014-10-03
23,Big List of Onion Sites,0.01870707,,rland,freestylerfreak13a,JAmvyj8iBs,Information/eBooks,2014-10-03
24,"Buy Bitcoins With Paypal, Paysafe, Credit- Debit C",0.05344878,,rland,freestylerfreak13a,JAmvyj8iBs,Information/eBooks,2014-10-03
25,Inviting Codes for Marketplaces,0.01336219,,rland,freestylerfreak13a,JAmvyj8iBs,Information/eBooks,2014-10-03
26,Earn 3$ every 15 minutes on Autopilot!,0.05344878,,rland,freestylerfreak13a,JAmvyj8iBs,Information/eBooks,2014-10-03
27,How do profit illegal from Bitcoins,0.02137951,,rland,freestylerfreak13a,JAmvyj8iBs,Information/eBooks,2014-10-03
28,How to access I2P Side for Hidden Marketplaces,0.02137951,,rland,freestylerfreak13a,JAmvyj8iBs,Information/eBooks,2014-10-03
29,Drug Smugglers on Drug Smuggling: Lessons from the Inside,0.03474170,,rland,freestylerfreak13a,JAmvyj8iBs,Information/eBooks,2014-10-03
30,Stealing the Network How to Own an Identity,0.00801731,,rland,RastainPeace,JAmvyj8iBs,Information/eBooks,2014-10-03
31,"WHERE TO BUY STOLEN BANK , EBAY , PAYPAL ACCOUNTS",0.00267243,,Internet,montana1933,JAmvyj8iBs,Information/eBooks,2014-10-03
32,TOP 5 OFFSHORE BANKING LICENCE JURISDICTIONS: 2012 REPORT,0.02137951,,,fake,JAmvyj8iBs,Information/eBooks,2014-10-03
33,"HACKING EXPOSED WEB APPLICATIONS, 3rd Edition",0.00400865,,Internet,blackhand,JAmvyj8iBs,Information/eBooks,2014-10-03
34,Hallucinogenic Plants (A Golden Guide),0.00400865,,Internet,blackhand,JAmvyj8iBs,Information/eBooks,2014-10-03
35,eBook How to Make $300 Easy - How To Make Money PDF,0.07215585,,Italy,gaioso,JAmvyj8iBs,Information/eBooks,2014-10-03
36,"Pharmacotheon: Entheogenic Drugs, Their Plant Sources and History",0.00400865,,Internet,blackhand,JAmvyj8iBs,Information/eBooks,2014-10-03
37,Secrets of Lock Picking,0.01870707,,,fake,JAmvyj8iBs,Information/eBooks,2014-10-03
38,Fooling The Bladder Cops: The Complete Drug Test Guide,0.00400865,,Internet,blackhand,JAmvyj8iBs,Information/eBooks,2014-10-03
39,Ebay scam Get anything free from ebay,0.00400865,,Internet,montana1933,JAmvyj8iBs,Information/eBooks,2014-10-03
40,Screw PayPal Toolkit Pro 2013,0.01603463,,,fake,JAmvyj8iBs,Information/eBooks,2014-10-03
41,The Construction & Operation Of Clandestine Drug Laboratories,0.00400865,,Internet,blackhand,JAmvyj8iBs,Information/eBooks,2014-10-03
42,ENCYCLOPEDIA OF MIND ENHANCING FOODS AND DRUGS,0.01336219,,,fake,JAmvyj8iBs,Information/eBooks,2014-10-03
43,Psilocybin: Magic Mushroom Grower's Guide: A Handbook for Psilocybin Enthusiasts,0.00400865,,Internet,blackhand,JAmvyj8iBs,Information/eBooks,2014-10-03
44,"Plants of the Gods: Their Sacred, Healing, and Hallucinogenic Powers",0.00400865,,Internet,blackhand,JAmvyj8iBs,Information/eBooks,2014-10-03
45,Storming Heaven: LSD and the American Dream,0.00400865,,Internet,blackhand,JAmvyj8iBs,Information/eBooks,2014-10-03
46,Cocaine: the Straight Facts,0.00400865,,Internet,blackhand,JAmvyj8iBs,Information/eBooks,2014-10-03
47,Essential Underground Handbook 2003 PML Publishing,0.00400865,,Internet,blackhand,JAmvyj8iBs,Information/eBooks,2014-10-03
48,Lockpicking book collection,0.00400865,,Internet,blackhand,JAmvyj8iBs,Information/eBooks,2014-10-03
49,PENIS ENLARGEMENT + CUM INCREASE,0.02672439,,,fake,JAmvyj8iBs,Information/eBooks,2014-10-03
50,Piracy: The Intellectual Property Wars from Gutenberg to Gates,0.00400865,,Internet,blackhand,JAmvyj8iBs,Information/eBooks,2014-10-03
51,Cocaine Nation: How the White Trade Took Over the World,0.00400865,,Internet,blackhand,JAmvyj8iBs,Information/eBooks,2014-10-03
52,Drug Trafficking Organizations in Central America,0.01336219,,,fake,JAmvyj8iBs,Information/eBooks,2014-10-03
53,EBAY STEALTH GUIDE,0.00267243,,Internet,montana1933,JAmvyj8iBs,Information/eBooks,2014-10-03
54,Ready Player One - Ernest Cline Audiobook,0.00668109,,Internet,blackhand,JAmvyj8iBs,Information/eBooks,2014-10-03
55,Sources by Strike,0.00400865,,Internet,blackhand,JAmvyj8iBs,Information/eBooks,2014-10-03
56,Vin DiCarlo- The Red Pill Guide to Picking up Women,0.00400865,,Internet,blackhand,JAmvyj8iBs,Information/eBooks,2014-10-03
57,PayPal Stealth,0.00133621,,Internet,montana1933,JAmvyj8iBs,Information/eBooks,2014-10-03
58,LSD: A Documentary Report,0.00534487,,Internet,blackhand,JAmvyj8iBs,Information/eBooks,2014-10-03
59,When a Man Makes Love to a Woman,0.00400865,,Internet,blackhand,JAmvyj8iBs,Information/eBooks,2014-10-03
60,Improvised Weapons of the American Underground,0.00264571,,Internet,captainkirk,JAmvyj8iBs,Information/eBooks,2014-10-03
61,22 Ways to Kill a Man with Your Bare Hands,0.01870707,,rland,Aracay,JAmvyj8iBs,Information/eBooks,2014-10-03
62,Production vs. Plunder,0.00267243,,,echo,JAmvyj8iBs,Information/eBooks,2014-10-03
63,Traffic Generation Techniques,0.02672439,,rland,Aracay,JAmvyj8iBs,Information/eBooks,2014-10-03
64,Cannabis Alchemy - D. Gold,0.00264571,,Internet,captainkirk,JAmvyj8iBs,Information/eBooks,2014-10-03
65,Adopt Creative Thinking & Change Your Life,0.02672439,,rland,Aracay,JAmvyj8iBs,Information/eBooks,2014-10-03
66,Find out today if the Government is Reading Your Email Email,0.01068975,,,cyberzen,JAmvyj8iBs,Information/eBooks,2014-10-03
67,40 Sleep Hacks - The Geek's Guide to Optimizing Sleep,0.00264571,,Internet,captainkirk,JAmvyj8iBs,Information/eBooks,2014-10-03
68,Anarchists Cookbook,0.00414000,,rland,KryptykOG,JAmvyj8iBs,Information/eBooks,2014-10-03
69,Almost FREE eBook - DMT The Spirit Molecule - Strassman,0.00080173,,USA,optiman,JAmvyj8iBs,Information/eBooks,2014-10-03
70,Hitler's Flying Saucers: A Guide to German Flying Discs of the Second World War,0.00264571,,Internet,captainkirk,JAmvyj8iBs,Information/eBooks,2014-10-03
71,Negotiate to Win: The 21 Rules for Successful Negotiating,0.00264571,,Internet,captainkirk,JAmvyj8iBs,Information/eBooks,2014-10-03
72,Self Sufficiency for the 21st Century,0.00264571,,Internet,captainkirk,JAmvyj8iBs,Information/eBooks,2014-10-03
73,SMUGGLING CACHING - EBOOKS COLLECTION,0.02672439,,,fake,JAmvyj8iBs,Information/eBooks,2014-10-03
74,Social Engineering,0.00267243,,rland,funnyreeferman,JAmvyj8iBs,Information/eBooks,2014-10-03
75,Cannabis Grow Bible,0.00668109,,USA,optiman,JAmvyj8iBs,Information/eBooks,2014-10-03
76,National Locksmith Guide to Manipulation,0.01336219,,,fake,JAmvyj8iBs,Information/eBooks,2014-10-03
77,Pimpology: The 48 Laws of the Game,0.00264571,,Internet,captainkirk,JAmvyj8iBs,Information/eBooks,2014-10-03
78,Tactics and Techniques for Bypassing Alarms and Defeating Lock,0.01068975,,,cyberzen,JAmvyj8iBs,Information/eBooks,2014-10-03
79,Toxicology – The Forensic Perspective,0.01336219,,rland,Aracay,JAmvyj8iBs,Information/eBooks,2014-10-03
80,Best Kept Secrets Of The Rich,0.02672439,,rland,Aracay,JAmvyj8iBs,Information/eBooks,2014-10-03
81,RICH DAD Stock Success,0.08017317,,Internet,RichDadPoorDad,JAmvyj8iBs,Information/eBooks,2014-10-03
82,The Hacker's Handbook,0.01068975,,USA,optiman,JAmvyj8iBs,Information/eBooks,2014-10-03
83,Sports Betting Super Guide - Defeat Betting Sites!,0.05344878,,rland,Aracay,JAmvyj8iBs,Information/eBooks,2014-10-03
84,Attitude Is Everything: Change Your Attitude Change Your Life!,0.00264571,,Internet,captainkirk,JAmvyj8iBs,Information/eBooks,2014-10-03
85,50 Things You're Not Supposed To Know,0.00414000,,rland,KryptykOG,JAmvyj8iBs,Information/eBooks,2014-10-03
86,"Atlantis, Alien Visitation, and Genetic Manipulation",0.01336219,,,fake,JAmvyj8iBs,Information/eBooks,2014-10-03
87,The Essential Psychedelics Guide,0.00200000,,rland,KryptykOG,JAmvyj8iBs,Information/eBooks,2014-10-03
88,How To Give A Woman A 'Rush' Just By Looking At Her,0.01068975,,,cyberzen,JAmvyj8iBs,Information/eBooks,2014-10-03
89,Mastering the Art of French Cooking,0.00264571,,Internet,captainkirk,JAmvyj8iBs,Information/eBooks,2014-10-03
90,All Agora's and Silk Road's  Money Making Methods & Guides,0.21379513,,,cyberzen,JAmvyj8iBs,Information/eBooks,2014-10-03
91,STEAL THIS BOOK,0.01336219,,,fake,JAmvyj8iBs,Information/eBooks,2014-10-03
92,Bye Bye Big Brother -- The Silk Road Edition,0.08017317,,,echo,JAmvyj8iBs,Information/eBooks,2014-10-03
93,Silent But Deadly: More Homemade Silencers,0.00264571,,Internet,captainkirk,JAmvyj8iBs,Information/eBooks,2014-10-03
94,The Navy SEAL Physical Fitness Guide,0.01336219,,,fake,JAmvyj8iBs,Information/eBooks,2014-10-03
95,Complete Idiot's Guide to Amazing Sex,0.00801731,,USA,optiman,JAmvyj8iBs,Information/eBooks,2014-10-03
96,The Lotto Black Book,0.00264571,,Internet,captainkirk,JAmvyj8iBs,Information/eBooks,2014-10-03
97,Hiding from Surveillance – How and why,0.01870707,,,fake,JAmvyj8iBs,Information/eBooks,2014-10-03
98,How to Make Her Want Anal Sex + Anal Sex Guide,0.01068975,,,cyberzen,JAmvyj8iBs,Information/eBooks,2014-10-03
99,CIA Book Of Dirty Tricks,0.01336219,,rland,Aracay,JAmvyj8iBs,Information/eBooks,2014-10-03
100,PAYPAL BUDDY - HOW TO STAY ON THE GOOD SIDE OF PAYPAL,0.02405195,,,fake,JAmvyj8iBs,Information/eBooks,2014-10-03
101,[Paypal] How to keep your Paypal active and avoid risking closure,0.02137951,,,cyberzen,JAmvyj8iBs,Information/eBooks,2014-10-03
102,Encyclopedia of Ancient and Forbidden Secrets,0.01336219,,,fake,JAmvyj8iBs,Information/eBooks,2014-10-03
103,101 Romantic Ideas,0.02672439,,rland,Aracay,JAmvyj8iBs,Information/eBooks,2014-10-03
104,REAL Genuine USA Identity Set Guide,0.21112269,,,starlight,JAmvyj8iBs,Information/eBooks,2014-10-03
105,Game Theory at Work: How to Use Game Theory to Outthink and Outmaneuver Your Competition,0.00264571,,Internet,captainkirk,JAmvyj8iBs,Information/eBooks,2014-10-03
106,WHY SUSPECTED CONFESS,0.01336219,,,fake,JAmvyj8iBs,Information/eBooks,2014-10-03
107,[ANDROID] Phone vip72 SOCKS + TOR Tutorial,0.01068975,,,cyberzen,JAmvyj8iBs,Information/eBooks,2014-10-03
108,The Construction of Secret Hiding Places,0.00264571,,Internet,captainkirk,JAmvyj8iBs,Information/eBooks,2014-10-03
109,ANATOMY OF A DATABASE ATTACK,0.01068975,,,fake,JAmvyj8iBs,Information/eBooks,2014-10-03
110,Operator's manual for AK-47 assault rifle,0.01336219,,,fake,JAmvyj8iBs,Information/eBooks,2014-10-03
111,How to Be Invisible,0.00264571,,Internet,captainkirk,JAmvyj8iBs,Information/eBooks,2014-10-03
112,269 Amazing Sex Tips and Tricks for Him,0.01068975,,,cyberzen,JAmvyj8iBs,Information/eBooks,2014-10-03
113,50 Things You're Not Supposed To Know,0.01068975,,,cyberzen,JAmvyj8iBs,Information/eBooks,2014-10-03
114,The Lord of the Rings Collection,0.00264571,,Internet,captainkirk,JAmvyj8iBs,Information/eBooks,2014-10-03
115,102 Drug Ebooks v2.0,0.00264571,,Internet,captainkirk,JAmvyj8iBs,Information/eBooks,2014-10-03
116,GANG INTELLIGENCE MANUAL,0.01870707,,,fake,JAmvyj8iBs,Information/eBooks,2014-10-03
117,THE BIG NARCOTICS COOKBOOK,0.01603463,,,fake,JAmvyj8iBs,Information/eBooks,2014-10-03
118,Recognizing Deception Profiles & Women,0.01336219,,rland,Aracay,JAmvyj8iBs,Information/eBooks,2014-10-03
119,How I made $3800 from PPC & Exchanging,0.02672439,,,cyberzen,JAmvyj8iBs,Information/eBooks,2014-10-03
120,A Clockwork Orange,0.00264571,,Internet,captainkirk,JAmvyj8iBs,Information/eBooks,2014-10-03
121,How to use the Yawara stick,0.01336219,,,fake,JAmvyj8iBs,Information/eBooks,2014-10-03
122,"STEALING , MEGA COLLECTION",0.02672439,,,fake,JAmvyj8iBs,Information/eBooks,2014-10-03
123,How To Make Money With Social Media,0.00264571,,Internet,captainkirk,JAmvyj8iBs,Information/eBooks,2014-10-03
124,COMMUNICATIONS JAMMING HANDBOOK,0.02137951,,,fake,JAmvyj8iBs,Information/eBooks,2014-10-03
125,SHELTER BUNKERS EBOOKS,0.02672439,,,fake,JAmvyj8iBs,Information/eBooks,2014-10-03
126,Anarchy Cookbook Version 2000,0.00264571,,Internet,captainkirk,JAmvyj8iBs,Information/eBooks,2014-10-03
127,How to disappear in America without a trace,0.01870707,,,fake,JAmvyj8iBs,Information/eBooks,2014-10-03
128,Become an expert in making small talks,0.01068975,,,cyberzen,JAmvyj8iBs,Information/eBooks,2014-10-03
129,How I make $35-$50 A Day With Neobux,0.02672439,,,cyberzen,JAmvyj8iBs,Information/eBooks,2014-10-03
130,BODY LANGUAGE How to read others thoughts by their gestures,0.00668109,,USA,optiman,JAmvyj8iBs,Information/eBooks,2014-10-03
131,How to Card! Over 50 carding guides to get you started,0.04334696,,Internet,starlight,JAmvyj8iBs,Information/eBooks,2014-10-03
132,Complete Book of Home Preserving,0.00264571,,Internet,captainkirk,JAmvyj8iBs,Information/eBooks,2014-10-03
133,GNUPG : High Level Cryptography,0.01336219,,,fake,JAmvyj8iBs,Information/eBooks,2014-10-03
134,A Guidebook To The Psilocybin Mushrooms Of Mexico,0.00264571,,Internet,captainkirk,JAmvyj8iBs,Information/eBooks,2014-10-03
135,"Marijuana Chemistry: Genetics, Processing, Potency",0.00264571,,Internet,captainkirk,JAmvyj8iBs,Information/eBooks,2014-10-03
136,13 Things that Don't Make Sense,0.00264571,,Internet,captainkirk,JAmvyj8iBs,Information/eBooks,2014-10-03
137,Carding CC + PAYPAL Tutorial,0.01600000,,Internet,KryptykOG,JAmvyj8iBs,Information/eBooks,2014-10-03
138,The Unofficial MacGyver How-To Handbook,0.00264571,,Internet,captainkirk,JAmvyj8iBs,Information/eBooks,2014-10-03
139,FRENCH FOREIGN LEGION - 5 EBOOKS,0.02672439,,,fake,JAmvyj8iBs,Information/eBooks,2014-10-03
140,"Underground eBook Collection - Make Money, PayPal, Hacking, Free Stuff & More! [180+ eBooks!!]",0.01336219,,Internet,MagicHat,JAmvyj8iBs,Information/eBooks,2014-10-03
141,[SOCKS5 Finder] Proxy Scanner Proxy For Windows,0.01068975,,,cyberzen,JAmvyj8iBs,Information/eBooks,2014-10-03
142,The Art And Science Of Cooking With Cannabis,0.00668109,,USA,optiman,JAmvyj8iBs,Information/eBooks,2014-10-03
143,How To Make A Girl Squirt,0.01068975,,,cyberzen,JAmvyj8iBs,Information/eBooks,2014-10-03
144,Being Logical: A Guide to Good Thinking,0.00264571,,Internet,captainkirk,JAmvyj8iBs,Information/eBooks,2014-10-03
145,Guns and Military Ebooks Collection,0.00264571,,Internet,captainkirk,JAmvyj8iBs,Information/eBooks,2014-10-03
146,PROTECTING YOUR IDENTITY AND SECURITY ONLINE AND WHEN USING MOBILE PHONES,0.01870707,,,fake,JAmvyj8iBs,Information/eBooks,2014-10-03
147,The World According to Monsanto,0.00264571,,Internet,captainkirk,JAmvyj8iBs,Information/eBooks,2014-10-03
148,Secrets of Meth Manufacture 8th,0.00264571,,Internet,captainkirk,JAmvyj8iBs,Information/eBooks,2014-10-03
149,Defensive Use of Firearms .Out-of-Home Defense,0.01336219,,,fake,JAmvyj8iBs,Information/eBooks,2014-10-03
150,The best GET LAID GUIDE ON EARTH,0.00133621,,Internet,montana1933,JAmvyj8iBs,Information/eBooks,2014-10-03
151,Illuminati ebook,0.01336219,,rland,Hackyboy,JAmvyj8iBs,Information/eBooks,2014-10-03
152,THE ANARCHIST COOKBOOK,0.01336219,,Internet,RastainPeace,JAmvyj8iBs,Information/eBooks,2014-10-03
153,ANAL SEX TUTORIAL,0.01336219,,,fake,JAmvyj8iBs,Information/eBooks,2014-10-03
154,The Construction of Secret Hiding Places,0.00400865,,Internet,blackhand,JAmvyj8iBs,Information/eBooks,2014-10-03
155,Dr Atomic's Marijuana Multiplier (1st ed.),0.00400865,,Internet,blackhand,JAmvyj8iBs,Information/eBooks,2014-10-03
156,Breaking Open the Head: A Psychedelic Journey,0.00400865,,Internet,blackhand,JAmvyj8iBs,Information/eBooks,2014-10-03
157,DMT & Ayahuasca Book Collection,0.01068975,,Internet,blackhand,JAmvyj8iBs,Information/eBooks,2014-10-03
158,Organic Chemistry Demystified 2/E,0.00400865,,Internet,blackhand,JAmvyj8iBs,Information/eBooks,2014-10-03
159,Psychedelic Chemistry,0.00400865,,Internet,blackhand,JAmvyj8iBs,Information/eBooks,2014-10-03
160,Entheogen: Awakening the Divine Within Documentary,0.00400865,,Internet,blackhand,JAmvyj8iBs,Information/eBooks,2014-10-03
161,Jitbit Macro Recorder,0.00400865,,Internet,blackhand,JAmvyj8iBs,Information/eBooks,2014-10-03
162,DMT: The Spirit Molecule - Documentary,0.00400865,,Internet,blackhand,JAmvyj8iBs,Information/eBooks,2014-10-03
163,"★ ★ ★ The 4-Hour Body: RADIP FAT LOSS, INCREDIBLE SEX ★ ★ ★",0.00133621,,Internet,montana1933,JAmvyj8iBs,Information/eBooks,2014-10-03
164,ENCYCLOPEDIA OF DRUGS,0.01336219,,,fake,JAmvyj8iBs,Information/eBooks,2014-10-03
165,HOW TO GET UNLIMITED AMAZON BALANCE,0.00400865,,,montana1933,JAmvyj8iBs,Information/eBooks,2014-10-03
166,Rational Mysticism: Spirituality Meets Science in the Search for Enlightenment,0.00400865,,Internet,blackhand,JAmvyj8iBs,Information/eBooks,2014-10-03
167,Ecstasy : The Complete Guide : A Comprehensive Look at the Risks and Benefits of MDMA,0.00400865,,Internet,blackhand,JAmvyj8iBs,Information/eBooks,2014-10-03
168,Data Exfiltration Techniques,0.01603463,,,fake,JAmvyj8iBs,Information/eBooks,2014-10-03
169,Fast Money eBay.es Vehicle Fraud Tutorial,0.02672439,,,fake,JAmvyj8iBs,Information/eBooks,2014-10-03
170,HOW TO GROW PSYCHEDELIC MUSHROOMS,0.01336219,,rland,Hackyboy,JAmvyj8iBs,Information/eBooks,2014-10-03
171,HACKING WIRELESS FOR DUMMIES,0.01336219,,,fake,JAmvyj8iBs,Information/eBooks,2014-10-03
172,The Book: On the Taboo Against Knowing Who You Are,0.00400865,,Internet,blackhand,JAmvyj8iBs,Information/eBooks,2014-10-03
173,"Rule by Secrecy: The Hidden History That Connects the Trilateral Commission, the Freemasons, and the",0.00400865,,Internet,blackhand,JAmvyj8iBs,Information/eBooks,2014-10-03
174,"Cheaper, Better, Faster: Over 2,000 Tips and Tricks to Save You",0.00400865,,Internet,blackhand,JAmvyj8iBs,Information/eBooks,2014-10-03
175,★ ★ ★ CVV to Moneygram cashout now!★ ★ ★,0.00400865,,Internet,montana1933,JAmvyj8iBs,Information/eBooks,2014-10-03
176,Ultimate Guide to Using Tor privately and anonymously,0.02137951,,Internet,blackhand,JAmvyj8iBs,Information/eBooks,2014-10-03
177,TOP 120 Onion and Underground Websites,0.02672439,,,cyberzen,JAmvyj8iBs,Information/eBooks,2014-10-03
178,Psychedelic Drugs Reconsidered,0.00400865,,Internet,blackhand,JAmvyj8iBs,Information/eBooks,2014-10-03
179,PAYPAL: THE DARKSIDE EBOOK,0.02405195,,,fake,JAmvyj8iBs,Information/eBooks,2014-10-03
180,11 SEO Mistakes You Must Avoid On Your Website,0.02672439,,rland,Aracay,JAmvyj8iBs,Information/eBooks,2014-10-03
181,DRUGS 2.0 - The Web Revolution,0.01336219,,,fake,JAmvyj8iBs,Information/eBooks,2014-10-03
182,70 of the Most Motivational Quotes You Will Ever Find,0.01870707,,rland,Aracay,JAmvyj8iBs,Information/eBooks,2014-10-03
183,Homemade C-4: A Recipe For Survival,0.00264571,,Internet,captainkirk,JAmvyj8iBs,Information/eBooks,2014-10-03
184,PGP & GPG: Email for the Practical Paranoid,0.00264571,,Internet,captainkirk,JAmvyj8iBs,Information/eBooks,2014-10-03
185,HOLOCAUST REVISIONISM - 28 BANNED EBOOKS,0.02672439,,,fake,JAmvyj8iBs,Information/eBooks,2014-10-03
186,How to Start Your Own International Bank,0.04008658,,,echo,JAmvyj8iBs,Information/eBooks,2014-10-03
187,Clandestine Drug Chemist Pack,0.00264571,,Internet,captainkirk,JAmvyj8iBs,Information/eBooks,2014-10-03
188,How Hawala Money Transfer System Works,0.02672439,,rland,Aracay,JAmvyj8iBs,Information/eBooks,2014-10-03
189,The sicilian blade The art of sicilian stiletto fighting,0.01336219,,,fake,JAmvyj8iBs,Information/eBooks,2014-10-03
190,The Alien Invasion Survival Handbook,0.00264571,,Internet,captainkirk,JAmvyj8iBs,Information/eBooks,2014-10-03
191,Over 40+ Marijuana Growing Books,0.01574066,,Internet,starlight,JAmvyj8iBs,Information/eBooks,2014-10-03
192,How To Tap The Incredible Secret Powers Of Your Mind,0.00264571,,Internet,captainkirk,JAmvyj8iBs,Information/eBooks,2014-10-03
193,How the Underground Economy Works,0.01336219,,,fake,JAmvyj8iBs,Information/eBooks,2014-10-03
194,"COCAINE Handbook, An Essential Reference",0.01870707,,,fake,JAmvyj8iBs,Information/eBooks,2014-10-03
195,The Modern Identity Change,0.02137951,,,fake,JAmvyj8iBs,Information/eBooks,2014-10-03
196,Just in Case: How to be Self-Sufficient when the Unexpected Happens,0.00264571,,Internet,captainkirk,JAmvyj8iBs,Information/eBooks,2014-10-03
197,How to Make A Million In Three Years or Less – Think Like A Tycoon,0.04008658,,Internet,blackhand,JAmvyj8iBs,Information/eBooks,2014-10-03
198,Dealing with Difficult People: 24 lessons,0.00264571,,Internet,captainkirk,JAmvyj8iBs,Information/eBooks,2014-10-03
199,"Zips, Pipes, And Pens: Arsenal Of Improvised Weapons",0.01336219,,,fake,JAmvyj8iBs,Information/eBooks,2014-10-03
200,40$ A Day From Google Adsense,0.02672439,,rland,Aracay,JAmvyj8iBs,Information/eBooks,2014-10-03
201,The danger of metadata [digital footprints],0.01336219,,,fake,JAmvyj8iBs,Information/eBooks,2014-10-03
202,Marijuana Horticulture: The Indoor/Outdoor Medical Grower's Bible,0.00516000,,rland,KryptykOG,JAmvyj8iBs,Information/eBooks,2014-10-03
203,"CC Range List Amex,MC,Visa",0.00264571,,,passman,JAmvyj8iBs,Information/eBooks,2014-10-03
204,The Essential Underground Handbook,0.00264571,,Internet,captainkirk,JAmvyj8iBs,Information/eBooks,2014-10-03
205,Techniques of the Professional Pickpocket,0.00200000,,rland,KryptykOG,JAmvyj8iBs,Information/eBooks,2014-10-03
206,LSD-25 & Tryptamine Syntheses Overview & Reference Guide,0.00264571,,Internet,captainkirk,JAmvyj8iBs,Information/eBooks,2014-10-03
207,Sabotage in the American Workplace,0.01336219,,,fake,JAmvyj8iBs,Information/eBooks,2014-10-03
208,The Power of Persuasion: How We're Bought and Sold,0.00264571,,Internet,captainkirk,JAmvyj8iBs,Information/eBooks,2014-10-03
209,Beyond Positive Thinking,0.00264571,,Internet,captainkirk,JAmvyj8iBs,Information/eBooks,2014-10-03
210,Indoor Marijuana Cultivation,0.01336219,,rland,Hackyboy,JAmvyj8iBs,Information/eBooks,2014-10-03
211,NEW MAKEING MONEY METHOD WORKING!!!!!,0.00534487,,Internet,montana1933,JAmvyj8iBs,Information/eBooks,2014-10-03
212,Steal This Book,0.00400865,,Internet,blackhand,JAmvyj8iBs,Information/eBooks,2014-10-03
213,expert resumes for career changers,0.00400865,,Internet,blackhand,JAmvyj8iBs,Information/eBooks,2014-10-03
214,Hacking Digital Cameras,0.02137951,,rland,Hackyboy,JAmvyj8iBs,Information/eBooks,2014-10-03
215,Satanic Bible Underground Edition,0.00400865,,Internet,blackhand,JAmvyj8iBs,Information/eBooks,2014-10-03
216,LOCALBITCOINS SCAMMING,0.00267243,,Internet,montana1933,JAmvyj8iBs,Information/eBooks,2014-10-03
217,Phenomenology and Mysticism: The Verticality of Religious Experience,0.00400865,,Internet,blackhand,JAmvyj8iBs,Information/eBooks,2014-10-03
218,Where God and Science Meet - Volums 1-3,0.01336219,,Internet,blackhand,JAmvyj8iBs,Information/eBooks,2014-10-03
219,eBook How to get free stuff from Amazon - Everything! - How To Make Money PDF,0.06681097,,Italy,gaioso,JAmvyj8iBs,Information/eBooks,2014-10-03
220,The Brainwashing Manual,0.01336219,,rland,Hackyboy,JAmvyj8iBs,Information/eBooks,2014-10-03
221,"Hacking Exposed Computer Forensics, Second Edition: Computer Forensics Secrets & Solutions",0.00400865,,Internet,blackhand,JAmvyj8iBs,Information/eBooks,2014-10-03
222,BYE BYE BIG BROTHER,0.08017317,,,fake,JAmvyj8iBs,Information/eBooks,2014-10-03
223,$3 Underground E-book – New Method PP to BTC.,0.00801731,,Internet,montana1933,JAmvyj8iBs,Information/eBooks,2014-10-03
224,THE CLANDESTINE CHEMIST'S BOOK,0.01336219,,rland,Hackyboy,JAmvyj8iBs,Information/eBooks,2014-10-03
225,How made Cyanide and Ricin,0.02672439,,rland,Hackyboy,JAmvyj8iBs,Information/eBooks,2014-10-03
226,Total Synthesis II - Ecstasy & Amphetamines Synthesis,0.00400865,,Internet,blackhand,JAmvyj8iBs,Information/eBooks,2014-10-03
